Term,Overlap,P.value,Adjusted.P.value,Old.P.value,Old.Adjusted.P.value,Odds.Ratio,Combined.Score,Genes
positive regulation of DNA recombination (GO:0045911),2/30,0.037352874448926196,0.16602177819056352,0,0,6.99009900990099,22.97886989951578,TFRC;PARP1
positive regulation of phosphate metabolic process (GO:0045937),2/30,0.037352874448926196,0.16602177819056352,0,0,6.99009900990099,22.97886989951578,NCKAP1L;SNCA
ubiquitin-dependent ERAD pathway (GO:0030433),3/73,0.03864143201371329,0.17100711489438128,0,0,4.205970149253731,13.683830345638446,HSPA5;EDEM1;STT3B
negative regulation of cell adhesion (GO:0007162),3/73,0.03864143201371329,0.17100711489438128,0,0,4.205970149253731,13.683830345638446,ARHGDIB;ADAM10;RHOA
negative regulation of cytokine production (GO:0001818),5/182,0.03902671624324272,0.1723399603069059,0,0,2.7849700479800132,9.033074957230793,CYLD;LEF1;NCKAP1L;HMGB1;HLA-DRB1
regulation of cellular pH (GO:0030641),2/31,0.03966628721748877,0.173562346875092,0,0,6.748719699556163,21.77983021931005,CA2;SLC4A1
regulation of cellular senescence (GO:2000772),2/31,0.03966628721748877,0.173562346875092,0,0,6.748719699556163,21.77983021931005,CDK6;YBX1
MyD88-independent toll-like receptor signaling pathway (GO:0002756),2/31,0.03966628721748877,0.173562346875092,0,0,6.748719699556163,21.77983021931005,UBB;UBE2D3
negative regulation of response to DNA damage stimulus (GO:2001021),2/31,0.03966628721748877,0.173562346875092,0,0,6.748719699556163,21.77983021931005,CD74;MDM2
proteolysis involved in cellular protein catabolic process (GO:0051603),3/74,0.03998117507322763,0.173562346875092,0,0,4.14652091654404,13.349087843731935,UBB;MDM2;PMAIP1
"DNA damage response, signal transduction by p53 class mediator (GO:0030330)",3/74,0.03998117507322763,0.173562346875092,0,0,4.14652091654404,13.349087843731935,PCNA;MDM2;SOX4
regulation of stress fiber assembly (GO:0051492),3/74,0.03998117507322763,0.173562346875092,0,0,4.14652091654404,13.349087843731935,STMN1;RHOA;ACTG1
Fc receptor mediated stimulatory signaling pathway (GO:0002431),3/74,0.03998117507322763,0.173562346875092,0,0,4.14652091654404,13.349087843731935,WIPF1;NCKAP1L;ACTG1
positive regulation of DNA-binding transcription factor activity (GO:0051091),6/246,0.04075078409593243,0.17652929516398636,0,0,2.4691919191919194,7.902106003711778,TFRC;UBB;PRKCB;DHX9;CTNNB1;PPIA
nucleic acid phosphodiester bond hydrolysis (GO:0090305),3/75,0.041344243493989505,0.1778861951833347,0,0,4.088723051409619,13.025944181810136,PCNA;PARP1;UBB
endoplasmic reticulum to Golgi vesicle-mediated transport (GO:0006888),5/185,0.04138766450308569,0.1778861951833347,0,0,2.7381351200446677,8.72033716165545,TMED10;ANK1;SPTAN1;SPTB;ERGIC1
regulation of cellular amide metabolic process (GO:0034248),2/32,0.04203263221939841,0.1778861951833347,0,0,6.523432343234323,20.674772867416195,RBM3;TMED10
cellular response to glucose stimulus (GO:0071333),2/32,0.04203263221939841,0.1778861951833347,0,0,6.523432343234323,20.674772867416195,XBP1;SOX4
establishment or maintenance of epithelial cell apical/basal polarity (GO:0045197),2/32,0.04203263221939841,0.1778861951833347,0,0,6.523432343234323,20.674772867416195,ANK1;RHOA
superoxide metabolic process (GO:0006801),2/32,0.04203263221939841,0.1778861951833347,0,0,6.523432343234323,20.674772867416195,PRDX2;PRDX1
negative regulation of microtubule polymerization or depolymerization (GO:0031111),2/32,0.04203263221939841,0.1778861951833347,0,0,6.523432343234323,20.674772867416195,STMN1;SNCA
microtubule cytoskeleton organization involved in mitosis (GO:1902850),4/128,0.04223959942843081,0.1778861951833347,0,0,3.1729032258064516,10.040325838847325,RANBP2;SUN2;XPO1;STMN1
regulation of epithelial to mesenchymal transition (GO:0010717),3/76,0.0427305292274579,0.1778861951833347,0,0,4.032508689429564,12.713861325901654,LEF1;CTNNB1;ADIPOR1
cellular response to hormone stimulus (GO:0032870),3/76,0.0427305292274579,0.1778861951833347,0,0,4.032508689429564,12.713861325901654,SOCS2;XBP1;NCOA4
regulation of RNA splicing (GO:0043484),3/76,0.0427305292274579,0.1778861951833347,0,0,4.032508689429564,12.713861325901654,RBM38;HNRNPK;MBNL3
RNA transport (GO:0050658),3/76,0.0427305292274579,0.1778861951833347,0,0,4.032508689429564,12.713861325901654,YBX1;SRSF5;HNRNPA1
cellular response to insulin stimulus (GO:0032869),4/129,0.043257011653179786,0.1778861951833347,0,0,3.14736,9.884586036445207,XBP1;PKM;PARP1;GAB1
cellular response to UV (GO:0034644),3/77,0.044139918940891816,0.1778861951833347,0,0,3.9778136345300523,12.412332729455924,PCNA;MME;PARP1
positive regulation of phosphatidylinositol 3-kinase signaling (GO:0014068),3/77,0.044139918940891816,0.1778861951833347,0,0,3.9778136345300523,12.412332729455924,FLT3;GAB1;PIK3AP1
positive regulation of tumor necrosis factor production (GO:0032760),3/77,0.044139918940891816,0.1778861951833347,0,0,3.9778136345300523,12.412332729455924,DHX9;HMGB1;HLA-E
antigen processing and presentation of peptide antigen via MHC class I (GO:0002474),2/33,0.04445060060490756,0.1778861951833347,0,0,6.31267965506228,19.653750416678832,CANX;HLA-E
regulation of histone acetylation (GO:0035065),2/33,0.04445060060490756,0.1778861951833347,0,0,6.31267965506228,19.653750416678832,SET;SNCA
exonucleolytic catabolism of deadenylated mRNA (GO:0043928),2/33,0.04445060060490756,0.1778861951833347,0,0,6.31267965506228,19.653750416678832,DDX6;DCP2
regulation of sprouting angiogenesis (GO:1903670),2/33,0.04445060060490756,0.1778861951833347,0,0,6.31267965506228,19.653750416678832,PKM;GLUL
signal transduction by p53 class mediator (GO:0072331),2/33,0.04445060060490756,0.1778861951833347,0,0,6.31267965506228,19.653750416678832,IFI16;PMAIP1
neuron projection extension (GO:1990138),2/33,0.04445060060490756,0.1778861951833347,0,0,6.31267965506228,19.653750416678832,CTNNB1;IQGAP1
cellular response to hypoxia (GO:0071456),4/131,0.04533305026575484,0.1778861951833347,0,0,3.09748031496063,9.582733473527458,BNIP3L;UBB;MDM2;PMAIP1
B cell receptor signaling pathway (GO:0050853),2/34,0.04691890447308999,0.1778861951833347,0,0,6.11509900990099,18.708134009682176,PRKCB;NCKAP1L
regulation of glucose metabolic process (GO:0010906),2/34,0.04691890447308999,0.1778861951833347,0,0,6.11509900990099,18.708134009682176,PMAIP1;ADIPOR1
central nervous system neuron differentiation (GO:0021953),2/34,0.04691890447308999,0.1778861951833347,0,0,6.11509900990099,18.708134009682176,CTNNB1;SOX4
regulation of transmembrane transport (GO:0034762),2/34,0.04691890447308999,0.1778861951833347,0,0,6.11509900990099,18.708134009682176,PRKCB;SNCA
synaptic vesicle recycling (GO:0036465),2/34,0.04691890447308999,0.1778861951833347,0,0,6.11509900990099,18.708134009682176,CANX;SNCA
positive regulation of telomerase activity (GO:0051973),2/34,0.04691890447308999,0.1778861951833347,0,0,6.11509900990099,18.708134009682176,XRCC5;CTNNB1
protein destabilization (GO:0031648),2/34,0.04691890447308999,0.1778861951833347,0,0,6.11509900990099,18.708134009682176,MDM2;SNCA
regulation of ion transport (GO:0043269),3/79,0.047027531563970534,0.1778861951833347,0,0,3.8727415553809896,11.839056409366725,CA2;WNK1;SNCA
negative regulation of gene expression (GO:0010629),7/322,0.04760589258082821,0.1778861951833347,0,0,2.197518330513254,6.691001025616005,DDX6;NCL;ATP2B4;ADAM10;YBX1;MACROH2A1;DCP2
regulation of NIK/NF-kappaB signaling (GO:1901222),3/80,0.0485055028998339,0.1778861951833347,0,0,3.8222523744911805,11.566433918832189,CYLD;ADIPOR1;RHOA
negative regulation of cellular component organization (GO:0051129),3/80,0.0485055028998339,0.1778861951833347,0,0,3.8222523744911805,11.566433918832189,HSPA5;RIOK3;XRCC5
"base-excision repair, gap-filling (GO:0006287)",2/35,0.049436276613114706,0.1778861951833347,0,0,5.9294929492949295,17.830404987401263,PCNA;PARP1
negative regulation of cell cycle G1/S phase transition (GO:1902807),2/35,0.049436276613114706,0.1778861951833347,0,0,5.9294929492949295,17.830404987401263,CDK6;FHL1
"nuclear-transcribed mRNA catabolic process, exonucleolytic (GO:0000291)",2/35,0.049436276613114706,0.1778861951833347,0,0,5.9294929492949295,17.830404987401263,DDX6;DCP2
positive regulation of cell cycle G1/S phase transition (GO:1902808),2/35,0.049436276613114706,0.1778861951833347,0,0,5.9294929492949295,17.830404987401263,KMT2E;CCND3
apoptotic chromosome condensation (GO:0030263),1/5,0.049974817934996855,0.1778861951833347,0,0,24.374384236453203,73.03140854408878,TOP2A
carbon dioxide transport (GO:0015670),1/5,0.049974817934996855,0.1778861951833347,0,0,24.374384236453203,73.03140854408878,CA2
regulation of cellular response to vascular endothelial growth factor stimulus (GO:1902547),1/5,0.049974817934996855,0.1778861951833347,0,0,24.374384236453203,73.03140854408878,ATP2B4
"CD4-positive, alpha-beta T cell activation (GO:0035710)",1/5,0.049974817934996855,0.1778861951833347,0,0,24.374384236453203,73.03140854408878,HMGB1
cellular response to antibiotic (GO:0071236),1/5,0.049974817934996855,0.1778861951833347,0,0,24.374384236453203,73.03140854408878,MDM2
cellular response to indole-3-methanol (GO:0071681),1/5,0.049974817934996855,0.1778861951833347,0,0,24.374384236453203,73.03140854408878,CTNNB1
cellular response to nutrient (GO:0031670),1/5,0.049974817934996855,0.1778861951833347,0,0,24.374384236453203,73.03140854408878,XBP1
regulation of guanyl-nucleotide exchange factor activity (GO:1905097),1/5,0.049974817934996855,0.1778861951833347,0,0,24.374384236453203,73.03140854408878,STMN1
cellular response to sodium arsenite (GO:1903936),1/5,0.049974817934996855,0.1778861951833347,0,0,24.374384236453203,73.03140854408878,HNRNPA1
cellular response to testosterone stimulus (GO:0071394),1/5,0.049974817934996855,0.1778861951833347,0,0,24.374384236453203,73.03140854408878,NCOA4
regulation of maintenance of mitotic sister chromatid cohesion (GO:0034182),1/5,0.049974817934996855,0.1778861951833347,0,0,24.374384236453203,73.03140854408878,MACROH2A1
regulation of natural killer cell mediated immunity (GO:0002715),1/5,0.049974817934996855,0.1778861951833347,0,0,24.374384236453203,73.03140854408878,HLA-E
dopamine biosynthetic process (GO:0042416),1/5,0.049974817934996855,0.1778861951833347,0,0,24.374384236453203,73.03140854408878,SNCA
embryonic skeletal joint morphogenesis (GO:0060272),1/5,0.049974817934996855,0.1778861951833347,0,0,24.374384236453203,73.03140854408878,CTNNB1
regulation of protein monoubiquitination (GO:1902525),1/5,0.049974817934996855,0.1778861951833347,0,0,24.374384236453203,73.03140854408878,UBB
regulation of synaptic vesicle recycling (GO:1903421),1/5,0.049974817934996855,0.1778861951833347,0,0,24.374384236453203,73.03140854408878,SNCA
glutamate catabolic process (GO:0006538),1/5,0.049974817934996855,0.1778861951833347,0,0,24.374384236453203,73.03140854408878,GLUL
response to acetylcholine (GO:1905144),1/5,0.049974817934996855,0.1778861951833347,0,0,24.374384236453203,73.03140854408878,ATP2B4
response to fructose (GO:0009750),1/5,0.049974817934996855,0.1778861951833347,0,0,24.374384236453203,73.03140854408878,XBP1
response to indole-3-methanol (GO:0071680),1/5,0.049974817934996855,0.1778861951833347,0,0,24.374384236453203,73.03140854408878,CTNNB1
response to sodium arsenite (GO:1903935),1/5,0.049974817934996855,0.1778861951833347,0,0,24.374384236453203,73.03140854408878,HNRNPA1
histone-threonine phosphorylation (GO:0035405),1/5,0.049974817934996855,0.1778861951833347,0,0,24.374384236453203,73.03140854408878,PRKCB
ribosome localization (GO:0033750),1/5,0.049974817934996855,0.1778861951833347,0,0,24.374384236453203,73.03140854408878,XPO1
Roundabout signaling pathway (GO:0035385),1/5,0.049974817934996855,0.1778861951833347,0,0,24.374384236453203,73.03140854408878,RHOA
kidney morphogenesis (GO:0060993),1/5,0.049974817934996855,0.1778861951833347,0,0,24.374384236453203,73.03140854408878,SOX4
mannose trimming involved in glycoprotein ERAD pathway (GO:1904382),1/5,0.049974817934996855,0.1778861951833347,0,0,24.374384236453203,73.03140854408878,EDEM1
meiotic mismatch repair (GO:0000710),1/5,0.049974817934996855,0.1778861951833347,0,0,24.374384236453203,73.03140854408878,MSH6
tight junction organization (GO:0120193),1/5,0.049974817934996855,0.1778861951833347,0,0,24.374384236453203,73.03140854408878,ACTG1
toll-like receptor 2 signaling pathway (GO:0034134),1/5,0.049974817934996855,0.1778861951833347,0,0,24.374384236453203,73.03140854408878,PIK3AP1
microtubule nucleation by microtubule organizing center (GO:0051418),1/5,0.049974817934996855,0.1778861951833347,0,0,24.374384236453203,73.03140854408878,NIN
mitochondrial DNA repair (GO:0043504),1/5,0.049974817934996855,0.1778861951833347,0,0,24.374384236453203,73.03140854408878,PARP1
ubiquitin-dependent glycoprotein ERAD pathway (GO:0097466),1/5,0.049974817934996855,0.1778861951833347,0,0,24.374384236453203,73.03140854408878,EDEM1
"negative regulation of CD4-positive, alpha-beta T cell differentiation (GO:0043371)",1/5,0.049974817934996855,0.1778861951833347,0,0,24.374384236453203,73.03140854408878,HMGB1
negative regulation of histone H3-K27 methylation (GO:0061086),1/5,0.049974817934996855,0.1778861951833347,0,0,24.374384236453203,73.03140854408878,MACROH2A1
negative regulation of interleukin-13 production (GO:0032696),1/5,0.049974817934996855,0.1778861951833347,0,0,24.374384236453203,73.03140854408878,LEF1
negative regulation of interleukin-5 production (GO:0032714),1/5,0.049974817934996855,0.1778861951833347,0,0,24.374384236453203,73.03140854408878,LEF1
negative regulation of IRE1-mediated unfolded protein response (GO:1903895),1/5,0.049974817934996855,0.1778861951833347,0,0,24.374384236453203,73.03140854408878,HSPA5
negative regulation of myosin-light-chain-phosphatase activity (GO:0035509),1/5,0.049974817934996855,0.1778861951833347,0,0,24.374384236453203,73.03140854408878,NCKAP1L
negative regulation of oxidative stress-induced neuron intrinsic apoptotic signaling pathway (GO:1903377),1/5,0.049974817934996855,0.1778861951833347,0,0,24.374384236453203,73.03140854408878,NONO
negative regulation of protein polyubiquitination (GO:1902915),1/5,0.049974817934996855,0.1778861951833347,0,0,24.374384236453203,73.03140854408878,PPIA
negative regulation of regulatory T cell differentiation (GO:0045590),1/5,0.049974817934996855,0.1778861951833347,0,0,24.374384236453203,73.03140854408878,IRF1
negative regulation of transcription by RNA polymerase I (GO:0016479),1/5,0.049974817934996855,0.1778861951833347,0,0,24.374384236453203,73.03140854408878,MACROH2A1
positive regulation by host of viral genome replication (GO:0044829),1/5,0.049974817934996855,0.1778861951833347,0,0,24.374384236453203,73.03140854408878,NUCKS1
positive regulation of attachment of spindle microtubules to kinetochore (GO:0051987),1/5,0.049974817934996855,0.1778861951833347,0,0,24.374384236453203,73.03140854408878,HNRNPU
positive regulation of cAMP-dependent protein kinase activity (GO:2000481),1/5,0.049974817934996855,0.1778861951833347,0,0,24.374384236453203,73.03140854408878,ATP2B4
"positive regulation of CD8-positive, alpha-beta T cell differentiation (GO:0043378)",1/5,0.049974817934996855,0.1778861951833347,0,0,24.374384236453203,73.03140854408878,NCKAP1L
positive regulation of dendritic cell differentiation (GO:2001200),1/5,0.049974817934996855,0.1778861951833347,0,0,24.374384236453203,73.03140854408878,HMGB1
positive regulation of deoxyribonuclease activity (GO:0032077),1/5,0.049974817934996855,0.1778861951833347,0,0,24.374384236453203,73.03140854408878,PCNA
positive regulation of DNA ligation (GO:0051106),1/5,0.049974817934996855,0.1778861951833347,0,0,24.374384236453203,73.03140854408878,HMGB1
positive regulation of interleukin-18 production (GO:0032741),1/5,0.049974817934996855,0.1778861951833347,0,0,24.374384236453203,73.03140854408878,DHX9
positive regulation of intrinsic apoptotic signaling pathway by p53 class mediator (GO:1902255),1/5,0.049974817934996855,0.1778861951833347,0,0,24.374384236453203,73.03140854408878,UBB
positive regulation of low-density lipoprotein receptor activity (GO:1905599),1/5,0.049974817934996855,0.1778861951833347,0,0,24.374384236453203,73.03140854408878,HNRNPK
positive regulation of maintenance of mitotic sister chromatid cohesion (GO:0034184),1/5,0.049974817934996855,0.1778861951833347,0,0,24.374384236453203,73.03140854408878,MACROH2A1
positive regulation of maintenance of sister chromatid cohesion (GO:0034093),1/5,0.049974817934996855,0.1778861951833347,0,0,24.374384236453203,73.03140854408878,MACROH2A1
positive regulation of MHC class I biosynthetic process (GO:0045345),1/5,0.049974817934996855,0.1778861951833347,0,0,24.374384236453203,73.03140854408878,CIITA
positive regulation of natural killer cell proliferation (GO:0032819),1/5,0.049974817934996855,0.1778861951833347,0,0,24.374384236453203,73.03140854408878,HLA-E
positive regulation of non-motile cilium assembly (GO:1902857),1/5,0.049974817934996855,0.1778861951833347,0,0,24.374384236453203,73.03140854408878,SEPTIN9
positive regulation of nucleobase-containing compound transport (GO:0032241),1/5,0.049974817934996855,0.1778861951833347,0,0,24.374384236453203,73.03140854408878,DHX9
positive regulation of prostaglandin biosynthetic process (GO:0031394),1/5,0.049974817934996855,0.1778861951833347,0,0,24.374384236453203,73.03140854408878,CD74
positive regulation of protein localization to cell cortex (GO:1904778),1/5,0.049974817934996855,0.1778861951833347,0,0,24.374384236453203,73.03140854408878,EPB41
positive regulation of protein monoubiquitination (GO:1902527),1/5,0.049974817934996855,0.1778861951833347,0,0,24.374384236453203,73.03140854408878,UBB
positive regulation of RNA export from nucleus (GO:0046833),1/5,0.049974817934996855,0.1778861951833347,0,0,24.374384236453203,73.03140854408878,DHX9
positive regulation of toll-like receptor 9 signaling pathway (GO:0034165),1/5,0.049974817934996855,0.1778861951833347,0,0,24.374384236453203,73.03140854408878,HMGB1
protein deglycosylation involved in glycoprotein catabolic process (GO:0035977),1/5,0.049974817934996855,0.1778861951833347,0,0,24.374384236453203,73.03140854408878,EDEM1
positive regulation of tumor necrosis factor superfamily cytokine production (GO:1903557),3/81,0.050006075366325425,0.1778861951833347,0,0,3.773057787983161,11.30261255913132,DHX9;HMGB1;HLA-E
"regulation of gene expression, epigenetic (GO:0040029)",3/82,0.05152911166665957,0.18245036372721174,0,0,3.725108634044965,11.047213291905953,IFI16;MACROH2A1;SF3B1
cellular component assembly (GO:0022607),6/261,0.05162473669115031,0.18245036372721174,0,0,2.3221628045157456,6.882320062500237,CD74;WIPF1;MDM2;NCKAP1L;RHOA;ACTG1
regulation of mRNA processing (GO:0050684),2/36,0.05200147018872213,0.18245036372721174,0,0,5.754804892253931,17.01398448930605,HNRNPK;DHX9
regulation of sodium ion transport (GO:0002028),2/36,0.05200147018872213,0.18245036372721174,0,0,5.754804892253931,17.01398448930605,WNK1;ATP2B4
retina homeostasis (GO:0001895),2/36,0.05200147018872213,0.18245036372721174,0,0,5.754804892253931,17.01398448930605,PRDX1;ACTG1
intrinsic apoptotic signaling pathway by p53 class mediator (GO:0072332),2/36,0.05200147018872213,0.18245036372721174,0,0,5.754804892253931,17.01398448930605,IFI16;PMAIP1
transition metal ion transport (GO:0000041),2/36,0.05200147018872213,0.18245036372721174,0,0,5.754804892253931,17.01398448930605,TFRC;FTH1
"Wnt signaling pathway, calcium modulating pathway (GO:0007223)",2/36,0.05200147018872213,0.18245036372721174,0,0,5.754804892253931,17.01398448930605,LEF1;CTNNB1
regulation of signal transduction (GO:0009966),5/198,0.05260252264625201,0.18392929846786754,0,0,2.5520087484052385,7.515643309781462,SOCS2;UBASH3B;NUCKS1;PPIA;CDC42SE2
negative regulation of intracellular signal transduction (GO:1902532),5/198,0.05260252264625201,0.18392929846786754,0,0,2.5520087484052385,7.515643309781462,CYLD;RIOK3;MDM2;ATP2B4;ADIPOR1
regulation of defense response (GO:0031347),3/83,0.05307447020423169,0.18526335510812733,0,0,3.678358208955224,10.799877656957179,CYLD;IRF1;PIK3AP1
protein dephosphorylation (GO:0006470),4/139,0.05418509182275143,0.18618521394647183,0,0,2.9127407407407406,8.49165716600708,PPP1R15A;PPP1R15B;UBASH3B;SSH2
regulation of intracellular pH (GO:0051453),2/37,0.05461325848439487,0.18618521394647183,0,0,5.59009900990099,16.253093222624923,CA2;SLC4A1
regulation of microtubule cytoskeleton organization (GO:0070507),2/37,0.05461325848439487,0.18618521394647183,0,0,5.59009900990099,16.253093222624923,CYLD;STMN1
tRNA transport (GO:0051031),2/37,0.05461325848439487,0.18618521394647183,0,0,5.59009900990099,16.253093222624923,RANBP2;YBX1
negative regulation of G1/S transition of mitotic cell cycle (GO:2000134),2/37,0.05461325848439487,0.18618521394647183,0,0,5.59009900990099,16.253093222624923,CDK6;FHL1
negative regulation of stress-activated MAPK cascade (GO:0032873),2/37,0.05461325848439487,0.18618521394647183,0,0,5.59009900990099,16.253093222624923,CYLD;PPIA
response to insulin (GO:0032868),3/84,0.05464200517266306,0.18618521394647183,0,0,3.63276211534918,10.560266428159668,XBP1;PKM;PARP1
neuron projection morphogenesis (GO:0048812),4/140,0.05535294711267685,0.18618521394647183,0,0,2.8911764705882352,8.367138072984039,UBB;CTNNB1;NCKAP1L;IQGAP1
regulation of protein phosphorylation (GO:0001932),6/266,0.055608188268137876,0.18618521394647183,0,0,2.276923076923077,6.578998046134878,CD74;PPP1R15B;CCND3;TFRC;PPIA;HLA-DRB1
regulation of cell cycle G2/M phase transition (GO:1902749),3/85,0.056231566767368284,0.18618521394647183,0,0,3.588278121587186,10.32805836370503,TUBA1A;TUBB;MACROH2A1
regulation of small GTPase mediated signal transduction (GO:0051056),4/141,0.056534357509779594,0.18618521394647183,0,0,2.86992700729927,8.245032608506026,ARHGEF12;ARHGDIB;RHOA;ARHGEF6
regulation of apoptotic signaling pathway (GO:2001233),2/38,0.057270434607893016,0.18618521394647183,0,0,5.434543454345435,15.542635394311274,CYLD;PPIA
regulation of cell communication (GO:0010646),2/38,0.057270434607893016,0.18618521394647183,0,0,5.434543454345435,15.542635394311274,SOCS2;CDC42SE2
regulation of phosphoprotein phosphatase activity (GO:0043666),2/38,0.057270434607893016,0.18618521394647183,0,0,5.434543454345435,15.542635394311274,PPP1R15A;PPP1R15B
synaptic vesicle endocytosis (GO:0048488),2/38,0.057270434607893016,0.18618521394647183,0,0,5.434543454345435,15.542635394311274,CANX;SNCA
negative regulation of endothelial cell migration (GO:0010596),2/38,0.057270434607893016,0.18618521394647183,0,0,5.434543454345435,15.542635394311274,ATP2B4;HMGB1
positive regulation of cell development (GO:0010720),2/38,0.057270434607893016,0.18618521394647183,0,0,5.434543454345435,15.542635394311274,MME;NAP1L1
positive regulation of insulin secretion (GO:0032024),2/38,0.057270434607893016,0.18618521394647183,0,0,5.434543454345435,15.542635394311274,SOX4;HLA-DRB1
positive regulation of production of molecular mediator of immune response (GO:0002702),2/38,0.057270434607893016,0.18618521394647183,0,0,5.434543454345435,15.542635394311274,XBP1;HLA-E
protein localization to organelle (GO:0033365),4/142,0.057729294154952475,0.18618521394647183,0,0,2.848985507246377,8.125279705700997,PPP1R15A;DHX9;MDM2;YBX1
negative regulation of cellular amide metabolic process (GO:0034249),3/86,0.05784300126124372,0.18618521394647183,0,0,3.5448660312893363,10.102949059806244,DDX6;NCL;YBX1
negative regulation of phosphorylation (GO:0042326),3/86,0.05784300126124372,0.18618521394647183,0,0,3.5448660312893363,10.102949059806244,PPP1R15B;HNRNPU;PPIA
neuron development (GO:0048666),4/143,0.05893772628897373,0.18618521394647183,0,0,2.828345323741007,8.0078202362455,XBP1;WNK1;STMN1;HMGB1
proteasomal protein catabolic process (GO:0010498),5/205,0.05930745321885344,0.18618521394647183,0,0,2.4618090452261305,6.954660513252739,IFI27;UBE2D3;MDM2;CTNNB1;PMAIP1
ERAD pathway (GO:0036503),3/87,0.05947615120804147,0.18618521394647183,0,0,3.5024875621890548,9.884649881773912,HSPA5;EDEM1;STT3B
positive regulation of gene expression (GO:0010628),9/482,0.05947809418958131,0.18618521394647183,0,0,1.8854773133842901,5.321094518935704,RBM3;CD74;TFRC;IFI16;LEF1;SF3B1;MACROH2A1;SOX4;ACTG1
adiponectin-activated signaling pathway (GO:0033211),1/6,0.05966747583495616,0.18618521394647183,0,0,19.498522167487685,54.965713945366076,ADIPOR1
astrocyte development (GO:0014002),1/6,0.05966747583495616,0.18618521394647183,0,0,19.498522167487685,54.965713945366076,CDK6
regulation of cardiac muscle hypertrophy in response to stress (GO:1903242),1/6,0.05966747583495616,0.18618521394647183,0,0,19.498522167487685,54.965713945366076,ATP2B4
cardiac ventricle formation (GO:0003211),1/6,0.05966747583495616,0.18618521394647183,0,0,19.498522167487685,54.965713945366076,SOX4
regulation of digestive system process (GO:0044058),1/6,0.05966747583495616,0.18618521394647183,0,0,19.498522167487685,54.965713945366076,EPB41
regulation of hepatocyte proliferation (GO:2000345),1/6,0.05966747583495616,0.18618521394647183,0,0,19.498522167487685,54.965713945366076,XBP1
cellular response to salt (GO:1902075),1/6,0.05966747583495616,0.18618521394647183,0,0,19.498522167487685,54.965713945366076,HNRNPA1
cellular triglyceride homeostasis (GO:0035356),1/6,0.05966747583495616,0.18618521394647183,0,0,19.498522167487685,54.965713945366076,XBP1
COPI coating of Golgi vesicle (GO:0048205),1/6,0.05966747583495616,0.18618521394647183,0,0,19.498522167487685,54.965713945366076,TMED10
COPI-coated vesicle budding (GO:0035964),1/6,0.05966747583495616,0.18618521394647183,0,0,19.498522167487685,54.965713945366076,TMED10
regulation of nitric oxide mediated signal transduction (GO:0010749),1/6,0.05966747583495616,0.18618521394647183,0,0,19.498522167487685,54.965713945366076,ATP2B4
regulation of non-motile cilium assembly (GO:1902855),1/6,0.05966747583495616,0.18618521394647183,0,0,19.498522167487685,54.965713945366076,SEPTIN9
regulation of nuclease activity (GO:0032069),1/6,0.05966747583495616,0.18618521394647183,0,0,19.498522167487685,54.965713945366076,HMGB2
