Term,Overlap,P.value,Adjusted.P.value,Old.P.value,Old.Adjusted.P.value,Odds.Ratio,Combined.Score,Genes
negative regulation of protein modification by small protein conjugation or removal (GO:1903321),2/55,0.10830798512229418,0.2283159069090337,0,0,3.68821221744816,8.198071061066498,CTNNB1;SOX4
"nuclear-transcribed mRNA catabolic process, nonsense-mediated decay (GO:0000184)",3/113,0.10897330904363366,0.2294823332275492,0,0,2.671099050203528,5.92089784754723,PABPC1;RPL15;GSPT1
regulation of immune response (GO:0050776),4/179,0.11103072546049544,0.23101885689760887,0,0,2.2424,4.928679290395782,IRF1;HLA-DRA;HLA-DRB1;HLA-E
cellular response to transforming growth factor beta stimulus (GO:0071560),3/114,0.11112294716819258,0.23101885689760887,0,0,2.646900631975259,5.815553177556838,JUN;UBB;RHOA
Rho protein signal transduction (GO:0007266),2/56,0.11159680181676472,0.23101885689760887,0,0,3.61972863953062,7.9375685946428876,ARHGDIB;RHOA
mitochondrial transport (GO:0006839),2/56,0.11159680181676472,0.23101885689760887,0,0,3.61972863953062,7.9375685946428876,PMAIP1;FBXO7
"nuclear-transcribed mRNA catabolic process, deadenylation-dependent decay (GO:0000288)",2/56,0.11159680181676472,0.23101885689760887,0,0,3.61972863953062,7.9375685946428876,DDX6;DCP2
positive regulation of establishment of protein localization to mitochondrion (GO:1903749),2/56,0.11159680181676472,0.23101885689760887,0,0,3.61972863953062,7.9375685946428876,UBE2D3;PMAIP1
cellular response to peptide (GO:1901653),2/57,0.11491149931147912,0.23101885689760887,0,0,3.5537353735373536,7.688837042343878,XBP1;MDM2
negative regulation of cell cycle G2/M phase transition (GO:1902750),2/57,0.11491149931147912,0.23101885689760887,0,0,3.5537353735373536,7.688837042343878,FHL1;MACROH2A1
negative regulation of DNA recombination (GO:0045910),2/57,0.11491149931147912,0.23101885689760887,0,0,3.5537353735373536,7.688837042343878,MSH6;H1-0
positive regulation of interferon-gamma production (GO:0032729),2/57,0.11491149931147912,0.23101885689760887,0,0,3.5537353735373536,7.688837042343878,HLA-DPB1;HLA-DPA1
protein K48-linked ubiquitination (GO:0070936),2/57,0.11491149931147912,0.23101885689760887,0,0,3.5537353735373536,7.688837042343878,IFI27;UBE2D3
adipose tissue development (GO:0060612),1/12,0.11579129625858678,0.23101885689760887,0,0,8.860277653381102,19.102456294823007,XBP1
pyrimidine nucleobase metabolic process (GO:0006206),1/12,0.11579129625858678,0.23101885689760887,0,0,8.860277653381102,19.102456294823007,DPYSL2
angiotensin maturation (GO:0002003),1/12,0.11579129625858678,0.23101885689760887,0,0,8.860277653381102,19.102456294823007,MME
regulation of amyloid precursor protein catabolic process (GO:1902991),1/12,0.11579129625858678,0.23101885689760887,0,0,8.860277653381102,19.102456294823007,TMED10
regulation of angiotensin levels in blood (GO:0002002),1/12,0.11579129625858678,0.23101885689760887,0,0,8.860277653381102,19.102456294823007,MME
catecholamine biosynthetic process (GO:0042423),1/12,0.11579129625858678,0.23101885689760887,0,0,8.860277653381102,19.102456294823007,SNCA
regulation of dendritic cell differentiation (GO:2001198),1/12,0.11579129625858678,0.23101885689760887,0,0,8.860277653381102,19.102456294823007,HMGB1
cellular response to growth hormone stimulus (GO:0071378),1/12,0.11579129625858678,0.23101885689760887,0,0,8.860277653381102,19.102456294823007,SOCS2
regulation of hemopoiesis (GO:1903706),1/12,0.11579129625858678,0.23101885689760887,0,0,8.860277653381102,19.102456294823007,PRKCB
regulation of histone H3-K9 methylation (GO:0051570),1/12,0.11579129625858678,0.23101885689760887,0,0,8.860277653381102,19.102456294823007,MYB
regulation of leukocyte cell-cell adhesion (GO:1903037),1/12,0.11579129625858678,0.23101885689760887,0,0,8.860277653381102,19.102456294823007,WNK1
regulation of myoblast fusion (GO:1901739),1/12,0.11579129625858678,0.23101885689760887,0,0,8.860277653381102,19.102456294823007,CD53
dosage compensation by inactivation of X chromosome (GO:0009048),1/12,0.11579129625858678,0.23101885689760887,0,0,8.860277653381102,19.102456294823007,HNRNPU
double-strand break repair via break-induced replication (GO:0000727),1/12,0.11579129625858678,0.23101885689760887,0,0,8.860277653381102,19.102456294823007,MCM7
regulation of plasminogen activation (GO:0010755),1/12,0.11579129625858678,0.23101885689760887,0,0,8.860277653381102,19.102456294823007,ENO1
regulation of response to oxidative stress (GO:1902882),1/12,0.11579129625858678,0.23101885689760887,0,0,8.860277653381102,19.102456294823007,MACROH2A1
regulation of RNA export from nucleus (GO:0046831),1/12,0.11579129625858678,0.23101885689760887,0,0,8.860277653381102,19.102456294823007,DHX9
regulation of sequestering of calcium ion (GO:0051282),1/12,0.11579129625858678,0.23101885689760887,0,0,8.860277653381102,19.102456294823007,UBASH3B
regulation of sister chromatid cohesion (GO:0007063),1/12,0.11579129625858678,0.23101885689760887,0,0,8.860277653381102,19.102456294823007,CTNNB1
ganglion development (GO:0061548),1/12,0.11579129625858678,0.23101885689760887,0,0,8.860277653381102,19.102456294823007,CTNNB1
glomerular visceral epithelial cell differentiation (GO:0072112),1/12,0.11579129625858678,0.23101885689760887,0,0,8.860277653381102,19.102456294823007,IQGAP1
glutamine metabolic process (GO:0006541),1/12,0.11579129625858678,0.23101885689760887,0,0,8.860277653381102,19.102456294823007,GLUL
replicative senescence (GO:0090399),1/12,0.11579129625858678,0.23101885689760887,0,0,8.860277653381102,19.102456294823007,MME
maintenance of protein localization in endoplasmic reticulum (GO:0035437),1/12,0.11579129625858678,0.23101885689760887,0,0,8.860277653381102,19.102456294823007,HSPA5
microtubule anchoring at microtubule organizing center (GO:0072393),1/12,0.11579129625858678,0.23101885689760887,0,0,8.860277653381102,19.102456294823007,NIN
mitochondrial genome maintenance (GO:0000002),1/12,0.11579129625858678,0.23101885689760887,0,0,8.860277653381102,19.102456294823007,PARP1
mitotic nuclear membrane disassembly (GO:0007077),1/12,0.11579129625858678,0.23101885689760887,0,0,8.860277653381102,19.102456294823007,PRKCB
modulation by host of viral process (GO:0044788),1/12,0.11579129625858678,0.23101885689760887,0,0,8.860277653381102,19.102456294823007,IFI27
morphogenesis of a polarized epithelium (GO:0001738),1/12,0.11579129625858678,0.23101885689760887,0,0,8.860277653381102,19.102456294823007,ACTG1
negative regulation of calcineurin-mediated signaling (GO:0106057),1/12,0.11579129625858678,0.23101885689760887,0,0,8.860277653381102,19.102456294823007,ATP2B4
negative regulation of calcineurin-NFAT signaling cascade (GO:0070885),1/12,0.11579129625858678,0.23101885689760887,0,0,8.860277653381102,19.102456294823007,ATP2B4
negative regulation of cardiac muscle hypertrophy (GO:0010614),1/12,0.11579129625858678,0.23101885689760887,0,0,8.860277653381102,19.102456294823007,ATP2B4
negative regulation of cellular response to vascular endothelial growth factor stimulus (GO:1902548),1/12,0.11579129625858678,0.23101885689760887,0,0,8.860277653381102,19.102456294823007,ATP2B4
negative regulation of glucose transmembrane transport (GO:0010829),1/12,0.11579129625858678,0.23101885689760887,0,0,8.860277653381102,19.102456294823007,PRKCB
negative regulation of oxidoreductase activity (GO:0051354),1/12,0.11579129625858678,0.23101885689760887,0,0,8.860277653381102,19.102456294823007,SNCA
negative regulation of transcription elongation from RNA polymerase II promoter (GO:0034244),1/12,0.11579129625858678,0.23101885689760887,0,0,8.860277653381102,19.102456294823007,HNRNPU
neurotransmitter uptake (GO:0001504),1/12,0.11579129625858678,0.23101885689760887,0,0,8.860277653381102,19.102456294823007,GLUL
P-body assembly (GO:0033962),1/12,0.11579129625858678,0.23101885689760887,0,0,8.860277653381102,19.102456294823007,DDX6
positive regulation of endoplasmic reticulum unfolded protein response (GO:1900103),1/12,0.11579129625858678,0.23101885689760887,0,0,8.860277653381102,19.102456294823007,XBP1
positive regulation of protein maturation (GO:1903319),1/12,0.11579129625858678,0.23101885689760887,0,0,8.860277653381102,19.102456294823007,SOX4
positive regulation of sodium ion transmembrane transport (GO:1902307),1/12,0.11579129625858678,0.23101885689760887,0,0,8.860277653381102,19.102456294823007,WNK1
posttranslational protein targeting to endoplasmic reticulum membrane (GO:0006620),1/12,0.11579129625858678,0.23101885689760887,0,0,8.860277653381102,19.102456294823007,HSPA5
protein auto-ADP-ribosylation (GO:0070213),1/12,0.11579129625858678,0.23101885689760887,0,0,8.860277653381102,19.102456294823007,PARP1
phosphorylation (GO:0016310),7/400,0.11599086032905981,0.23119189962475054,0,0,1.7543173040906215,3.7792273181022775,CDK6;PRKCB;WNK1;STRADB;ADAM10;ERG;HK1
regulation of canonical Wnt signaling pathway (GO:0060828),5/253,0.11755001436974427,0.23407189450301846,0,0,1.9804668503809368,4.239964411826845,CYLD;ZEB2;WNK1;CTNNB1;SOX4
regulation of tumor necrosis factor-mediated signaling pathway (GO:0010803),2/58,0.11825121427848563,0.2345563775959507,0,0,3.49009900990099,7.451165880993574,CYLD;H2BC11
muscle organ development (GO:0007517),2/58,0.11825121427848563,0.2345563775959507,0,0,3.49009900990099,7.451165880993574,FHL1;UTRN
positive regulation of mitochondrion organization (GO:0010822),2/58,0.11825121427848563,0.2345563775959507,0,0,3.49009900990099,7.451165880993574,PMAIP1;FBXO7
positive regulation of mitotic cell cycle phase transition (GO:1901992),2/58,0.11825121427848563,0.2345563775959507,0,0,3.49009900990099,7.451165880993574,KMT2E;CCND3
positive regulation of apoptotic signaling pathway (GO:2001235),2/59,0.12161509810928037,0.23870433090357648,0,0,3.4286955011290603,7.223898510859551,CYLD;PMAIP1
positive regulation of cysteine-type endopeptidase activity involved in apoptotic process (GO:0043280),3/119,0.1221108533743568,0.23870433090357648,0,0,2.5321667524446734,5.324706115258784,PMAIP1;HMGB1;SNCA
positive regulation of cell differentiation (GO:0045597),5/258,0.12478048502896999,0.23870433090357648,0,0,1.9408306353903906,4.039255175868363,XBP1;LEF1;CTNNB1;MACROH2A1;RHOA
regulation of actomyosin structure organization (GO:0110020),1/13,0.12481562554868265,0.23870433090357648,0,0,8.12151067323481,16.900194711039827,ACTG1
regulation of antigen receptor-mediated signaling pathway (GO:0050854),1/13,0.12481562554868265,0.23870433090357648,0,0,8.12151067323481,16.900194711039827,PAX5
cardiac right ventricle morphogenesis (GO:0003215),1/13,0.12481562554868265,0.23870433090357648,0,0,8.12151067323481,16.900194711039827,SOX4
regulation of interleukin-5 production (GO:0032674),1/13,0.12481562554868265,0.23870433090357648,0,0,8.12151067323481,16.900194711039827,LEF1
regulation of leukocyte adhesion to vascular endothelial cell (GO:1904994),1/13,0.12481562554868265,0.23870433090357648,0,0,8.12151067323481,16.900194711039827,RHOA
regulation of mRNA metabolic process (GO:1903311),1/13,0.12481562554868265,0.23870433090357648,0,0,8.12151067323481,16.900194711039827,DHX9
regulation of nucleocytoplasmic transport (GO:0046822),1/13,0.12481562554868265,0.23870433090357648,0,0,8.12151067323481,16.900194711039827,IFI27
DNA replication-independent nucleosome organization (GO:0034724),1/13,0.12481562554868265,0.23870433090357648,0,0,8.12151067323481,16.900194711039827,NASP
regulation of platelet-derived growth factor receptor signaling pathway (GO:0010640),1/13,0.12481562554868265,0.23870433090357648,0,0,8.12151067323481,16.900194711039827,SNCA
regulation of response to stress (GO:0080134),1/13,0.12481562554868265,0.23870433090357648,0,0,8.12151067323481,16.900194711039827,MACROH2A1
"regulation of retrograde protein transport, ER to cytosol (GO:1904152)",1/13,0.12481562554868265,0.23870433090357648,0,0,8.12151067323481,16.900194711039827,EDEM1
establishment of protein localization to chromosome (GO:0070199),1/13,0.12481562554868265,0.23870433090357648,0,0,8.12151067323481,16.900194711039827,MACROH2A1
response to iron ion (GO:0010039),1/13,0.12481562554868265,0.23870433090357648,0,0,8.12151067323481,16.900194711039827,SNCA
response to UV-B (GO:0010224),1/13,0.12481562554868265,0.23870433090357648,0,0,8.12151067323481,16.900194711039827,MME
ribosomal subunit export from nucleus (GO:0000054),1/13,0.12481562554868265,0.23870433090357648,0,0,8.12151067323481,16.900194711039827,XPO1
spinal cord development (GO:0021510),1/13,0.12481562554868265,0.23870433090357648,0,0,8.12151067323481,16.900194711039827,SOX4
lipid oxidation (GO:0034440),1/13,0.12481562554868265,0.23870433090357648,0,0,8.12151067323481,16.900194711039827,ADIPOR1
mature B cell differentiation involved in immune response (GO:0002313),1/13,0.12481562554868265,0.23870433090357648,0,0,8.12151067323481,16.900194711039827,DOCK11
toll-like receptor 9 signaling pathway (GO:0034162),1/13,0.12481562554868265,0.23870433090357648,0,0,8.12151067323481,16.900194711039827,PIK3AP1
mitochondrion transport along microtubule (GO:0047497),1/13,0.12481562554868265,0.23870433090357648,0,0,8.12151067323481,16.900194711039827,UBB
negative regulation by host of viral transcription (GO:0043922),1/13,0.12481562554868265,0.23870433090357648,0,0,8.12151067323481,16.900194711039827,JUN
"negative regulation of CD4-positive, alpha-beta T cell activation (GO:2000515)",1/13,0.12481562554868265,0.23870433090357648,0,0,8.12151067323481,16.900194711039827,HMGB1
negative regulation of chromatin organization (GO:1905268),1/13,0.12481562554868265,0.23870433090357648,0,0,8.12151067323481,16.900194711039827,H1-0
negative regulation of chromatin silencing (GO:0031936),1/13,0.12481562554868265,0.23870433090357648,0,0,8.12151067323481,16.900194711039827,H1-0
negative regulation of gene silencing (GO:0060969),1/13,0.12481562554868265,0.23870433090357648,0,0,8.12151067323481,16.900194711039827,H1-0
negative regulation of histone methylation (GO:0031061),1/13,0.12481562554868265,0.23870433090357648,0,0,8.12151067323481,16.900194711039827,MACROH2A1
negative regulation of intrinsic apoptotic signaling pathway in response to DNA damage by p53 class mediator (GO:1902166),1/13,0.12481562554868265,0.23870433090357648,0,0,8.12151067323481,16.900194711039827,CD74
negative regulation of myotube differentiation (GO:0010832),1/13,0.12481562554868265,0.23870433090357648,0,0,8.12151067323481,16.900194711039827,XBP1
negative regulation of stem cell differentiation (GO:2000737),1/13,0.12481562554868265,0.23870433090357648,0,0,8.12151067323481,16.900194711039827,HNRNPU
polyamine metabolic process (GO:0006595),1/13,0.12481562554868265,0.23870433090357648,0,0,8.12151067323481,16.900194711039827,SAT1
positive regulation of nuclear-transcribed mRNA poly(A) tail shortening (GO:0060213),1/13,0.12481562554868265,0.23870433090357648,0,0,8.12151067323481,16.900194711039827,PABPC1
positive regulation of protein exit from endoplasmic reticulum (GO:0070863),1/13,0.12481562554868265,0.23870433090357648,0,0,8.12151067323481,16.900194711039827,EDEM1
positive regulation of purine nucleotide biosynthetic process (GO:1900373),1/13,0.12481562554868265,0.23870433090357648,0,0,8.12151067323481,16.900194711039827,ENO1
positive regulation of vascular endothelial cell proliferation (GO:1905564),1/13,0.12481562554868265,0.23870433090357648,0,0,8.12151067323481,16.900194711039827,HMGB1
protein localization to mitochondrion (GO:0070585),1/13,0.12481562554868265,0.23870433090357648,0,0,8.12151067323481,16.900194711039827,HK1
cellular protein catabolic process (GO:0044257),2/60,0.12500231676893,0.23870433090357648,0,0,3.3694093547285764,7.006427334582721,BNIP3L;MDM2
ribonucleoprotein complex biogenesis (GO:0022613),2/60,0.12500231676893,0.23870433090357648,0,0,3.3694093547285764,7.006427334582721,XPO1;GLUL
response to light stimulus (GO:0009416),2/61,0.12841205056805619,0.24453186952969064,0,0,3.312132908206075,6.798189361212573,MSH6;FECH
pattern recognition receptor signaling pathway (GO:0002221),2/61,0.12841205056805619,0.24453186952969064,0,0,3.312132908206075,6.798189361212573,UBB;HMGB1
positive regulation of interleukin-8 production (GO:0032757),2/61,0.12841205056805619,0.24453186952969064,0,0,3.312132908206075,6.798189361212573,CD74;HMGB1
negative regulation of cell differentiation (GO:0045596),4/191,0.13180319657011833,0.24578499029160353,0,0,2.0972192513368983,4.249900313094531,CDK6;MYB;HNRNPU;ADIPOR1
stress-activated MAPK cascade (GO:0051403),2/62,0.13184349398019252,0.24578499029160353,0,0,3.2567656765676567,6.598662268350372,UBB;ARHGEF6
regulation of tumor necrosis factor production (GO:0032680),3/124,0.13347825374235606,0.24578499029160353,0,0,2.4269150117182683,4.887361998829472,DHX9;HMGB1;HLA-E
non-canonical Wnt signaling pathway (GO:0035567),3/124,0.13347825374235606,0.24578499029160353,0,0,2.4269150117182683,4.887361998829472,LEF1;CTNNB1;RHOA
activation of cysteine-type endopeptidase activity (GO:0097202),1/14,0.13374829876775887,0.24578499029160353,0,0,7.496400151572566,15.08122493657931,IFI16
amyloid precursor protein catabolic process (GO:0042987),1/14,0.13374829876775887,0.24578499029160353,0,0,7.496400151572566,15.08122493657931,ADAM10
regulation of cAMP-dependent protein kinase activity (GO:2000479),1/14,0.13374829876775887,0.24578499029160353,0,0,7.496400151572566,15.08122493657931,ATP2B4
branching involved in blood vessel morphogenesis (GO:0001569),1/14,0.13374829876775887,0.24578499029160353,0,0,7.496400151572566,15.08122493657931,CTNNB1
calcium ion import across plasma membrane (GO:0098703),1/14,0.13374829876775887,0.24578499029160353,0,0,7.496400151572566,15.08122493657931,ATP2B4
regulation of chromatin organization (GO:1902275),1/14,0.13374829876775887,0.24578499029160353,0,0,7.496400151572566,15.08122493657931,HNRNPU
cellular response to low-density lipoprotein particle stimulus (GO:0071404),1/14,0.13374829876775887,0.24578499029160353,0,0,7.496400151572566,15.08122493657931,CD9
regulation of intrinsic apoptotic signaling pathway in response to DNA damage by p53 class mediator (GO:1902165),1/14,0.13374829876775887,0.24578499029160353,0,0,7.496400151572566,15.08122493657931,CD74
regulation of IRE1-mediated unfolded protein response (GO:1903894),1/14,0.13374829876775887,0.24578499029160353,0,0,7.496400151572566,15.08122493657931,HSPA5
regulation of macrophage cytokine production (GO:0010935),1/14,0.13374829876775887,0.24578499029160353,0,0,7.496400151572566,15.08122493657931,CD74
covalent chromatin modification (GO:0016569),1/14,0.13374829876775887,0.24578499029160353,0,0,7.496400151572566,15.08122493657931,CHD1
defense response to protozoan (GO:0042832),1/14,0.13374829876775887,0.24578499029160353,0,0,7.496400151572566,15.08122493657931,GBP4
detection of bacterium (GO:0016045),1/14,0.13374829876775887,0.24578499029160353,0,0,7.496400151572566,15.08122493657931,HLA-DRB1
dicarboxylic acid catabolic process (GO:0043649),1/14,0.13374829876775887,0.24578499029160353,0,0,7.496400151572566,15.08122493657931,GLUL
regulation of trophoblast cell migration (GO:1901163),1/14,0.13374829876775887,0.24578499029160353,0,0,7.496400151572566,15.08122493657931,ARHGDIB
response to UV-A (GO:0070141),1/14,0.13374829876775887,0.24578499029160353,0,0,7.496400151572566,15.08122493657931,MME
secondary palate development (GO:0062009),1/14,0.13374829876775887,0.24578499029160353,0,0,7.496400151572566,15.08122493657931,LEF1
vascular endothelial growth factor signaling pathway (GO:0038084),1/14,0.13374829876775887,0.24578499029160353,0,0,7.496400151572566,15.08122493657931,GAB1
myeloid dendritic cell activation (GO:0001773),1/14,0.13374829876775887,0.24578499029160353,0,0,7.496400151572566,15.08122493657931,HMGB1
negative regulation of cell migration involved in sprouting angiogenesis (GO:0090051),1/14,0.13374829876775887,0.24578499029160353,0,0,7.496400151572566,15.08122493657931,RHOA
"negative regulation of DNA-templated transcription, elongation (GO:0032785)",1/14,0.13374829876775887,0.24578499029160353,0,0,7.496400151572566,15.08122493657931,HNRNPU
"negative regulation of mRNA splicing, via spliceosome (GO:0048025)",1/14,0.13374829876775887,0.24578499029160353,0,0,7.496400151572566,15.08122493657931,RBMX
negative regulation of secretion (GO:0051048),1/14,0.13374829876775887,0.24578499029160353,0,0,7.496400151572566,15.08122493657931,CD74
negative regulation of T cell differentiation (GO:0045581),1/14,0.13374829876775887,0.24578499029160353,0,0,7.496400151572566,15.08122493657931,IRF1
nuclear membrane disassembly (GO:0051081),1/14,0.13374829876775887,0.24578499029160353,0,0,7.496400151572566,15.08122493657931,PRKCB
peptidyl-serine dephosphorylation (GO:0070262),1/14,0.13374829876775887,0.24578499029160353,0,0,7.496400151572566,15.08122493657931,PPP1R15B
polarized epithelial cell differentiation (GO:0030859),1/14,0.13374829876775887,0.24578499029160353,0,0,7.496400151572566,15.08122493657931,RHOA
positive regulation of alpha-beta T cell differentiation (GO:0046638),1/14,0.13374829876775887,0.24578499029160353,0,0,7.496400151572566,15.08122493657931,NCKAP1L
positive regulation of brown fat cell differentiation (GO:0090336),1/14,0.13374829876775887,0.24578499029160353,0,0,7.496400151572566,15.08122493657931,HNRNPU
positive regulation of glucose metabolic process (GO:0010907),1/14,0.13374829876775887,0.24578499029160353,0,0,7.496400151572566,15.08122493657931,PMAIP1
positive regulation of insulin secretion involved in cellular response to glucose stimulus (GO:0035774),1/14,0.13374829876775887,0.24578499029160353,0,0,7.496400151572566,15.08122493657931,HLA-DRB1
positive regulation of sodium ion transmembrane transporter activity (GO:2000651),1/14,0.13374829876775887,0.24578499029160353,0,0,7.496400151572566,15.08122493657931,WNK1
positive regulation of T-helper cell differentiation (GO:0045624),1/14,0.13374829876775887,0.24578499029160353,0,0,7.496400151572566,15.08122493657931,MYB
positive regulation of transmembrane transport (GO:0034764),1/14,0.13374829876775887,0.24578499029160353,0,0,7.496400151572566,15.08122493657931,CA2
positive regulation of type 2 immune response (GO:0002830),1/14,0.13374829876775887,0.24578499029160353,0,0,7.496400151572566,15.08122493657931,CD74
actin cytoskeleton reorganization (GO:0031532),2/63,0.13529585534312058,0.24840609999825633,0,0,3.2032137639993508,6.4073608719788195,GAB1;RHOA
regulation of phosphorylation (GO:0042325),3/125,0.13579485533617197,0.24909906766680068,0,0,2.4068999265965254,4.8056403389621645,RANBP2;MCM7;NCKAP1L
regulation of programmed cell death (GO:0043067),4/194,0.13723190269650445,0.2515099898257045,0,0,2.0637894736842104,4.098857320887728,PRDX2;BNIP3L;FLT3;PMAIP1
protein deubiquitination (GO:0016579),5/267,0.13829887248660622,0.2529587933862486,0,0,1.8732977866431393,3.7060165581941993,CYLD;UBB;MDM2;EIF3F;RHOA
regulation of transcription initiation from RNA polymerase II promoter (GO:0060260),2/64,0.13876835684009844,0.2529587933862486,0,0,3.151389332481635,6.223833946822459,LEF1;CTNNB1
pre-replicative complex assembly (GO:0036388),2/64,0.13876835684009844,0.2529587933862486,0,0,3.151389332481635,6.223833946822459,MCM7;UBB
protein catabolic process (GO:0030163),2/64,0.13876835684009844,0.2529587933862486,0,0,3.151389332481635,6.223833946822459,PMAIP1;STT3B
regulation of cellular catabolic process (GO:0031329),2/65,0.14226023416837882,0.2529587933862486,0,0,3.1012101210121013,6.0476613708930715,IFI16;DCAF12
chemical homeostasis (GO:0048878),2/65,0.14226023416837882,0.2529587933862486,0,0,3.1012101210121013,6.0476613708930715,WNK1;SLC4A1
regulation of RNA metabolic process (GO:0051252),2/65,0.14226023416837882,0.2529587933862486,0,0,3.1012101210121013,6.0476613708930715,RBM38;MBNL3
calcium ion import into cytosol (GO:1902656),1/15,0.14259024224554276,0.2529587933862486,0,0,6.960591133004926,13.557701594688005,ATP2B4
cellular response to arsenic-containing substance (GO:0071243),1/15,0.14259024224554276,0.2529587933862486,0,0,6.960591133004926,13.557701594688005,HNRNPA1
cellular response to estrogen stimulus (GO:0071391),1/15,0.14259024224554276,0.2529587933862486,0,0,6.960591133004926,13.557701594688005,NCOA4
cellular response to exogenous dsRNA (GO:0071360),1/15,0.14259024224554276,0.2529587933862486,0,0,6.960591133004926,13.557701594688005,DHX9
contractile actin filament bundle assembly (GO:0030038),1/15,0.14259024224554276,0.2529587933862486,0,0,6.960591133004926,13.557701594688005,RHOA
"regulation of nuclear-transcribed mRNA catabolic process, deadenylation-dependent decay (GO:1900151)",1/15,0.14259024224554276,0.2529587933862486,0,0,6.960591133004926,13.557701594688005,PABPC1
regulation of nuclear-transcribed mRNA poly(A) tail shortening (GO:0060211),1/15,0.14259024224554276,0.2529587933862486,0,0,6.960591133004926,13.557701594688005,PABPC1
establishment of apical/basal cell polarity (GO:0035089),1/15,0.14259024224554276,0.2529587933862486,0,0,6.960591133004926,13.557701594688005,RHOA
response to muscle stretch (GO:0035994),1/15,0.14259024224554276,0.2529587933862486,0,0,6.960591133004926,13.557701594688005,CTNNB1
histone mRNA catabolic process (GO:0071044),1/15,0.14259024224554276,0.2529587933862486,0,0,6.960591133004926,13.557701594688005,DCP2
integrated stress response signaling (GO:0140467),1/15,0.14259024224554276,0.2529587933862486,0,0,6.960591133004926,13.557701594688005,HSPA5
interleukin-27-mediated signaling pathway (GO:0070106),1/15,0.14259024224554276,0.2529587933862486,0,0,6.960591133004926,13.557701594688005,CANX
stress fiber assembly (GO:0043149),1/15,0.14259024224554276,0.2529587933862486,0,0,6.960591133004926,13.557701594688005,RHOA
T cell proliferation (GO:0042098),1/15,0.14259024224554276,0.2529587933862486,0,0,6.960591133004926,13.557701594688005,DOCK8
myoblast fusion (GO:0007520),1/15,0.14259024224554276,0.2529587933862486,0,0,6.960591133004926,13.557701594688005,CD9
negative regulation of cellular component movement (GO:0051271),1/15,0.14259024224554276,0.2529587933862486,0,0,6.960591133004926,13.557701594688005,CD9
