Term,Overlap,P.value,Adjusted.P.value,Old.P.value,Old.Adjusted.P.value,Odds.Ratio,Combined.Score,Genes
cellular response to organic cyclic compound (GO:0071407),2/150,0.04665195983622821,0.09943437000549911,0,0,6.082923832923833,18.644406939607435,NR3C1;ACTB
extrinsic apoptotic signaling pathway in absence of ligand (GO:0097192),1/21,0.047227961937659255,0.09943437000549911,0,0,22.148888888888887,67.61544465949056,MCL1
purinergic nucleotide receptor signaling pathway (GO:0035590),1/21,0.047227961937659255,0.09943437000549911,0,0,22.148888888888887,67.61544465949056,CTSG
regulation of anoikis (GO:2000209),1/21,0.047227961937659255,0.09943437000549911,0,0,22.148888888888887,67.61544465949056,MCL1
histone ubiquitination (GO:0016574),1/21,0.047227961937659255,0.09943437000549911,0,0,22.148888888888887,67.61544465949056,USP22
hydrogen peroxide catabolic process (GO:0042744),1/21,0.047227961937659255,0.09943437000549911,0,0,22.148888888888887,67.61544465949056,MPO
cellular response to steroid hormone stimulus (GO:0071383),1/21,0.047227961937659255,0.09943437000549911,0,0,22.148888888888887,67.61544465949056,NR3C1
regulation of lipopolysaccharide-mediated signaling pathway (GO:0031664),1/21,0.047227961937659255,0.09943437000549911,0,0,22.148888888888887,67.61544465949056,LTF
positive regulation of T cell cytokine production (GO:0002726),1/21,0.047227961937659255,0.09943437000549911,0,0,22.148888888888887,67.61544465949056,B2M
NAD biosynthetic process (GO:0009435),1/21,0.047227961937659255,0.09943437000549911,0,0,22.148888888888887,67.61544465949056,NAMPT
negative regulation of biomineral tissue development (GO:0070168),1/22,0.049421635543190894,0.1008911289127571,0,0,21.09312169312169,63.43475777373824,SRGN
regulation of adenylate cyclase activity (GO:0045761),1/22,0.049421635543190894,0.1008911289127571,0,0,21.09312169312169,63.43475777373824,CAP1
regulation of voltage-gated calcium channel activity (GO:1901385),1/22,0.049421635543190894,0.1008911289127571,0,0,21.09312169312169,63.43475777373824,AHNAK
regulation of cardiac muscle cell membrane repolarization (GO:0099623),1/22,0.049421635543190894,0.1008911289127571,0,0,21.09312169312169,63.43475777373824,FLNA
positive regulation of granulocyte chemotaxis (GO:0071624),1/22,0.049421635543190894,0.1008911289127571,0,0,21.09312169312169,63.43475777373824,RIPOR2
positive regulation of neutrophil migration (GO:1902624),1/22,0.049421635543190894,0.1008911289127571,0,0,21.09312169312169,63.43475777373824,RIPOR2
microglial cell activation (GO:0001774),1/22,0.049421635543190894,0.1008911289127571,0,0,21.09312169312169,63.43475777373824,ITGB2
osteoclast differentiation (GO:0030316),1/22,0.049421635543190894,0.1008911289127571,0,0,21.09312169312169,63.43475777373824,GAB2
peptidyl-threonine dephosphorylation (GO:0035970),1/22,0.049421635543190894,0.1008911289127571,0,0,21.09312169312169,63.43475777373824,DUSP6
mRNA modification (GO:0016556),1/22,0.049421635543190894,0.1008911289127571,0,0,21.09312169312169,63.43475777373824,WTAP
protein localization to cell junction (GO:1902414),1/22,0.049421635543190894,0.1008911289127571,0,0,21.09312169312169,63.43475777373824,JAK1
regulation of toll-like receptor 4 signaling pathway (GO:0034143),1/23,0.05161036810287483,0.10308124872439055,0,0,20.133333333333333,59.67585824831113,LTF
negative regulation of extrinsic apoptotic signaling pathway in absence of ligand (GO:2001240),1/23,0.05161036810287483,0.10308124872439055,0,0,20.133333333333333,59.67585824831113,MCL1
glucose 6-phosphate metabolic process (GO:0051156),1/23,0.05161036810287483,0.10308124872439055,0,0,20.133333333333333,59.67585824831113,TKT
hexose transmembrane transport (GO:0008645),1/23,0.05161036810287483,0.10308124872439055,0,0,20.133333333333333,59.67585824831113,SLC2A3
regulation of cysteine-type endopeptidase activity (GO:2000116),1/23,0.05161036810287483,0.10308124872439055,0,0,20.133333333333333,59.67585824831113,LTF
negative regulation of signal transduction in absence of ligand (GO:1901099),1/23,0.05161036810287483,0.10308124872439055,0,0,20.133333333333333,59.67585824831113,MCL1
regulation of interferon-gamma-mediated signaling pathway (GO:0060334),1/23,0.05161036810287483,0.10308124872439055,0,0,20.133333333333333,59.67585824831113,JAK1
DNA methylation (GO:0006306),1/23,0.05161036810287483,0.10308124872439055,0,0,20.133333333333333,59.67585824831113,FOS
negative regulation of neuron differentiation (GO:0045665),1/24,0.05379417048562001,0.10601037863699517,0,0,19.257004830917875,56.28033307969816,B2M
negative regulation of ossification (GO:0030279),1/24,0.05379417048562001,0.10601037863699517,0,0,19.257004830917875,56.28033307969816,SRGN
positive regulation of neuron apoptotic process (GO:0043525),1/24,0.05379417048562001,0.10601037863699517,0,0,19.257004830917875,56.28033307969816,MCL1
lymphocyte activation involved in immune response (GO:0002285),1/24,0.05379417048562001,0.10601037863699517,0,0,19.257004830917875,56.28033307969816,LCP1
positive regulation of protein targeting to membrane (GO:0090314),1/24,0.05379417048562001,0.10601037863699517,0,0,19.257004830917875,56.28033307969816,ITGB2
regulation of neuron projection development (GO:0010975),2/165,0.05528205448031779,0.10865276133232672,0,0,5.518962632459565,15.979090785031437,CFL1;S100A9
cAMP-mediated signaling (GO:0019933),1/25,0.05597305354060756,0.10942880044049998,0,0,18.453703703703702,53.19990358724921,CAP1
regulation of neutrophil chemotaxis (GO:0090022),1/25,0.05597305354060756,0.10942880044049998,0,0,18.453703703703702,53.19990358724921,RIPOR2
glial cell development (GO:0021782),1/26,0.05814702809836536,0.1127838681487979,0,0,17.714666666666666,50.394338453793885,S100A9
negative regulation of interleukin-1 beta production (GO:0032691),1/26,0.05814702809836536,0.1127838681487979,0,0,17.714666666666666,50.394338453793885,SERPINB1
positive regulation of filopodium assembly (GO:0051491),1/26,0.05814702809836536,0.1127838681487979,0,0,17.714666666666666,50.394338453793885,RIPOR2
positive regulation of cellular component movement (GO:0051272),1/27,0.06031610495649811,0.11415091640394642,0,0,17.032478632478632,47.829859287186046,ETS1
regulation of vasculature development (GO:1901342),1/27,0.06031610495649811,0.11415091640394642,0,0,17.032478632478632,47.829859287186046,ETS1
positive regulation of erythrocyte differentiation (GO:0045648),1/27,0.06031610495649811,0.11415091640394642,0,0,17.032478632478632,47.829859287186046,ETS1
response to glucocorticoid (GO:0051384),1/27,0.06031610495649811,0.11415091640394642,0,0,17.032478632478632,47.829859287186046,NR3C1
positive regulation of mitotic cell cycle (GO:0045931),1/27,0.06031610495649811,0.11415091640394642,0,0,17.032478632478632,47.829859287186046,USP22
cellular response to cadmium ion (GO:0071276),1/27,0.06031610495649811,0.11415091640394642,0,0,17.032478632478632,47.829859287186046,FOS
positive regulation of nitric oxide biosynthetic process (GO:0045429),1/27,0.06031610495649811,0.11415091640394642,0,0,17.032478632478632,47.829859287186046,MMP8
positive regulation of toll-like receptor signaling pathway (GO:0034123),1/27,0.06031610495649811,0.11415091640394642,0,0,17.032478632478632,47.829859287186046,LTF
regulation of protein transport (GO:0051223),1/28,0.06248029490822359,0.11415091640394642,0,0,16.40082304526749,45.47790870164399,LCP1
regulation of reactive oxygen species biosynthetic process (GO:1903426),1/28,0.06248029490822359,0.11415091640394642,0,0,16.40082304526749,45.47790870164399,MMP8
carbohydrate derivative biosynthetic process (GO:1901137),1/28,0.06248029490822359,0.11415091640394642,0,0,16.40082304526749,45.47790870164399,TKT
regulation of extrinsic apoptotic signaling pathway in absence of ligand (GO:2001239),1/28,0.06248029490822359,0.11415091640394642,0,0,16.40082304526749,45.47790870164399,MCL1
positive regulation of nitric oxide metabolic process (GO:1904407),1/28,0.06248029490822359,0.11415091640394642,0,0,16.40082304526749,45.47790870164399,MMP8
cellular response to interleukin-6 (GO:0071354),1/28,0.06248029490822359,0.11415091640394642,0,0,16.40082304526749,45.47790870164399,JAK1
leukocyte cell-cell adhesion (GO:0007159),1/28,0.06248029490822359,0.11415091640394642,0,0,16.40082304526749,45.47790870164399,ITGB2
positive regulation of protein import into nucleus (GO:0042307),1/28,0.06248029490822359,0.11415091640394642,0,0,16.40082304526749,45.47790870164399,FLNA
T cell activation involved in immune response (GO:0002286),1/28,0.06248029490822359,0.11415091640394642,0,0,16.40082304526749,45.47790870164399,LCP1
regulation of multicellular organismal development (GO:2000026),1/28,0.06248029490822359,0.11415091640394642,0,0,16.40082304526749,45.47790870164399,DUSP6
protein depolymerization (GO:0051261),1/28,0.06248029490822359,0.11415091640394642,0,0,16.40082304526749,45.47790870164399,CFL1
regulation of postsynapse organization (GO:0099175),1/28,0.06248029490822359,0.11415091640394642,0,0,16.40082304526749,45.47790870164399,CFL1
protein localization to cell surface (GO:0034394),1/28,0.06248029490822359,0.11415091640394642,0,0,16.40082304526749,45.47790870164399,FLNA
protein localization to Golgi apparatus (GO:0034067),1/28,0.06248029490822359,0.11415091640394642,0,0,16.40082304526749,45.47790870164399,SORL1
protein localization to lysosome (GO:0061462),1/28,0.06248029490822359,0.11415091640394642,0,0,16.40082304526749,45.47790870164399,SORL1
positive regulation of developmental process (GO:0051094),2/177,0.0625590272579138,0.11415091640394642,0,0,5.137402597402597,14.239054844290033,CFL1;SORL1
regulation of protein targeting to membrane (GO:0090313),1/29,0.06463960869794699,0.11566264122949838,0,0,15.814285714285715,43.31418865156708,ITGB2
regulation of response to biotic stimulus (GO:0002831),1/29,0.06463960869794699,0.11566264122949838,0,0,15.814285714285715,43.31418865156708,SAMHD1
regulation of calcium ion transmembrane transporter activity (GO:1901019),1/29,0.06463960869794699,0.11566264122949838,0,0,15.814285714285715,43.31418865156708,AHNAK
response to cadmium ion (GO:0046686),1/29,0.06463960869794699,0.11566264122949838,0,0,15.814285714285715,43.31418865156708,FOS
hydrogen peroxide metabolic process (GO:0042743),1/29,0.06463960869794699,0.11566264122949838,0,0,15.814285714285715,43.31418865156708,MPO
transition metal ion homeostasis (GO:0055076),1/29,0.06463960869794699,0.11566264122949838,0,0,15.814285714285715,43.31418865156708,B2M
positive regulation of viral genome replication (GO:0045070),1/29,0.06463960869794699,0.11566264122949838,0,0,15.814285714285715,43.31418865156708,ADAR
production of miRNAs involved in gene silencing by miRNA (GO:0035196),1/29,0.06463960869794699,0.11566264122949838,0,0,15.814285714285715,43.31418865156708,ADAR
transmembrane receptor protein tyrosine kinase signaling pathway (GO:0007169),3/404,0.0656620327267365,0.11696873975876386,0,0,3.401902221191208,9.264177184853882,NAMPT;CYBB;ACTB
regulation of type I interferon-mediated signaling pathway (GO:0060338),1/30,0.0667940570746933,0.11696873975876386,0,0,15.268199233716475,41.317902512852925,SAMHD1
negative regulation of interleukin-1 production (GO:0032692),1/30,0.0667940570746933,0.11696873975876386,0,0,15.268199233716475,41.317902512852925,SERPINB1
heterotypic cell-cell adhesion (GO:0034113),1/30,0.0667940570746933,0.11696873975876386,0,0,15.268199233716475,41.317902512852925,ITGB2
positive regulation of protein import (GO:1904591),1/30,0.0667940570746933,0.11696873975876386,0,0,15.268199233716475,41.317902512852925,FLNA
maintenance of blood-brain barrier (GO:0035633),1/30,0.0667940570746933,0.11696873975876386,0,0,15.268199233716475,41.317902512852925,ACTB
morphogenesis of an epithelium (GO:0002009),1/30,0.0667940570746933,0.11696873975876386,0,0,15.268199233716475,41.317902512852925,ACTB
plasma membrane invagination (GO:0099024),1/30,0.0667940570746933,0.11696873975876386,0,0,15.268199233716475,41.317902512852925,ITGB2
regulation of protein localization to membrane (GO:1905475),1/30,0.0667940570746933,0.11696873975876386,0,0,15.268199233716475,41.317902512852925,ACTB
negative regulation of interleukin-6 production (GO:0032715),1/31,0.06894365075528797,0.1198808421368419,0,0,14.75851851851852,39.471152501452366,BPI
regulation of cellular senescence (GO:2000772),1/31,0.06894365075528797,0.1198808421368419,0,0,14.75851851851852,39.471152501452366,B2M
negative regulation of response to biotic stimulus (GO:0002832),1/31,0.06894365075528797,0.1198808421368419,0,0,14.75851851851852,39.471152501452366,LTF
gene silencing by miRNA (GO:0035195),1/32,0.07108840042475308,0.12217285561370353,0,0,14.281720430107526,37.75845663463361,ADAR
regulation of cell morphogenesis (GO:0022604),1/32,0.07108840042475308,0.12217285561370353,0,0,14.281720430107526,37.75845663463361,CFL1
regulation of dendritic spine morphogenesis (GO:0061001),1/32,0.07108840042475308,0.12217285561370353,0,0,14.281720430107526,37.75845663463361,CFL1
superoxide metabolic process (GO:0006801),1/32,0.07108840042475308,0.12217285561370353,0,0,14.281720430107526,37.75845663463361,CYBB
regulation of intracellular protein transport (GO:0033157),1/32,0.07108840042475308,0.12217285561370353,0,0,14.281720430107526,37.75845663463361,LCP1
actin filament bundle assembly (GO:0051017),1/33,0.07322831674647272,0.12469061307751922,0,0,13.834722222222222,36.16635856889997,LCP1
regulation of sprouting angiogenesis (GO:1903670),1/33,0.07322831674647272,0.12469061307751922,0,0,13.834722222222222,36.16635856889997,JAK1
antigen processing and presentation of peptide antigen via MHC class I (GO:0002474),1/33,0.07322831674647272,0.12469061307751922,0,0,13.834722222222222,36.16635856889997,B2M
positive regulation of cytokine production involved in immune response (GO:0002720),1/33,0.07322831674647272,0.12469061307751922,0,0,13.834722222222222,36.16635856889997,B2M
regulation of amyloid-beta formation (GO:1902003),1/34,0.07536341037599187,0.12686460197689747,0,0,13.414814814814815,34.683110213712276,SORL1
regulation of transmembrane transport (GO:0034762),1/34,0.07536341037599187,0.12686460197689747,0,0,13.414814814814815,34.683110213712276,ACTB
positive regulation of DNA binding (GO:0043388),1/34,0.07536341037599187,0.12686460197689747,0,0,13.414814814814815,34.683110213712276,MMP8
response to steroid hormone (GO:0048545),1/34,0.07536341037599187,0.12686460197689747,0,0,13.414814814814815,34.683110213712276,NR3C1
regulation of myoblast differentiation (GO:0045661),1/34,0.07536341037599187,0.12686460197689747,0,0,13.414814814814815,34.683110213712276,RIPOR2
endomembrane system organization (GO:0010256),2/199,0.07668281267544108,0.12879226947079764,0,0,4.558606368251039,11.706855269793019,SRGN;SYNE1
negative regulation of Ras protein signal transduction (GO:0046580),1/35,0.07749369193278241,0.12898161787911305,0,0,13.019607843137255,33.298411835161396,RIPOR2
semaphorin-plexin signaling pathway (GO:0071526),1/35,0.07749369193278241,0.12898161787911305,0,0,13.019607843137255,33.298411835161396,FLNA
peptidyl-tyrosine dephosphorylation (GO:0035335),1/35,0.07749369193278241,0.12898161787911305,0,0,13.019607843137255,33.298411835161396,DUSP6
muscle cell differentiation (GO:0042692),1/35,0.07749369193278241,0.12898161787911305,0,0,13.019607843137255,33.298411835161396,SYNE1
axon guidance (GO:0007411),2/203,0.07935154632457563,0.12903194763859008,0,0,4.466983265490728,11.318743026227803,EMB;GAB2
activation of adenylate cyclase activity (GO:0007190),1/36,0.07961917202056437,0.12903194763859008,0,0,12.646984126984126,32.00319789387239,CAP1
positive regulation of bone mineralization (GO:0030501),1/36,0.07961917202056437,0.12903194763859008,0,0,12.646984126984126,32.00319789387239,LTF
negative regulation of cellular protein localization (GO:1903828),1/36,0.07961917202056437,0.12903194763859008,0,0,12.646984126984126,32.00319789387239,RIPOR2
calcium-dependent cell-cell adhesion via plasma membrane cell adhesion molecules (GO:0016339),1/36,0.07961917202056437,0.12903194763859008,0,0,12.646984126984126,32.00319789387239,SELL
regulation of embryonic development (GO:0045995),1/36,0.07961917202056437,0.12903194763859008,0,0,12.646984126984126,32.00319789387239,CFL1
macrophage activation (GO:0042116),1/36,0.07961917202056437,0.12903194763859008,0,0,12.646984126984126,32.00319789387239,ITGB2
positive regulation of substrate adhesion-dependent cell spreading (GO:1900026),1/36,0.07961917202056437,0.12903194763859008,0,0,12.646984126984126,32.00319789387239,FLNA
cyclic-nucleotide-mediated signaling (GO:0019935),1/36,0.07961917202056437,0.12903194763859008,0,0,12.646984126984126,32.00319789387239,CAP1
transition metal ion transport (GO:0000041),1/36,0.07961917202056437,0.12903194763859008,0,0,12.646984126984126,32.00319789387239,LTF
positive regulation of T cell mediated immunity (GO:0002711),1/36,0.07961917202056437,0.12903194763859008,0,0,12.646984126984126,32.00319789387239,B2M
regulation of protein import into nucleus (GO:0042306),1/36,0.07961917202056437,0.12903194763859008,0,0,12.646984126984126,32.00319789387239,FLNA
regulation of transport (GO:0051049),1/37,0.08173986122317027,0.13131686400852788,0,0,12.295061728395062,30.789459546748624,ACTB
regulation of erythrocyte differentiation (GO:0045646),1/37,0.08173986122317027,0.13131686400852788,0,0,12.295061728395062,30.789459546748624,ETS1
positive regulation of myeloid cell differentiation (GO:0045639),1/37,0.08173986122317027,0.13131686400852788,0,0,12.295061728395062,30.789459546748624,ETS1
"phagocytosis, engulfment (GO:0006911)",1/37,0.08173986122317027,0.13131686400852788,0,0,12.295061728395062,30.789459546748624,ITGB2
negative regulation of innate immune response (GO:0045824),1/38,0.08385577009174108,0.13384322699308135,0,0,11.962162162162162,29.650096722737764,SAMHD1
positive regulation of potassium ion transport (GO:0043268),1/38,0.08385577009174108,0.13384322699308135,0,0,11.962162162162162,29.650096722737764,FLNA
connective tissue development (GO:0061448),1/38,0.08385577009174108,0.13384322699308135,0,0,11.962162162162162,29.650096722737764,NAMPT
regulation of receptor-mediated endocytosis (GO:0048259),1/39,0.08596690914993177,0.13545745386311212,0,0,11.646783625730993,28.57879420114118,B2M
replication fork processing (GO:0031297),1/39,0.08596690914993177,0.13545745386311212,0,0,11.646783625730993,28.57879420114118,SAMHD1
positive regulation of intracellular transport (GO:0032388),1/39,0.08596690914993177,0.13545745386311212,0,0,11.646783625730993,28.57879420114118,SORL1
cellular response to ketone (GO:1901655),1/39,0.08596690914993177,0.13545745386311212,0,0,11.646783625730993,28.57879420114118,NR3C1
regulation of intracellular transport (GO:0032386),1/39,0.08596690914993177,0.13545745386311212,0,0,11.646783625730993,28.57879420114118,LCP1
organophosphate biosynthetic process (GO:0090407),1/39,0.08596690914993177,0.13545745386311212,0,0,11.646783625730993,28.57879420114118,TKT
bone development (GO:0060348),1/40,0.08807328892912575,0.13783568803902133,0,0,11.347578347578347,27.569917287159008,LTF
carboxylic acid metabolic process (GO:0019752),1/40,0.08807328892912575,0.13783568803902133,0,0,11.347578347578347,27.569917287159008,SLC2A3
regulation of nitric oxide biosynthetic process (GO:0045428),1/40,0.08807328892912575,0.13783568803902133,0,0,11.347578347578347,27.569917287159008,MMP8
extracellular structure organization (GO:0043062),2/216,0.08822230100467807,0.13783568803902133,0,0,4.1928632115548,10.179833732134922,ITGB2;MMP8
external encapsulating structure organization (GO:0045229),2/217,0.08891669681947872,0.13833566094651534,0,0,4.173150105708245,10.099254191077135,ITGB2;MMP8
regulation of cell growth (GO:0001558),2/217,0.08891669681947872,0.13833566094651534,0,0,4.173150105708245,10.099254191077135,S100A9;S100A8
regulation of response to DNA damage stimulus (GO:2001020),1/41,0.09017491989219245,0.13912164050173326,0,0,11.063333333333333,26.618423595643765,MCL1
positive regulation of cation transmembrane transport (GO:1904064),1/41,0.09017491989219245,0.13912164050173326,0,0,11.063333333333333,26.618423595643765,FLNA
regulation of filopodium assembly (GO:0051489),1/41,0.09017491989219245,0.13912164050173326,0,0,11.063333333333333,26.618423595643765,RIPOR2
cortical cytoskeleton organization (GO:0030865),1/41,0.09017491989219245,0.13912164050173326,0,0,11.063333333333333,26.618423595643765,LCP1
ATP-dependent chromatin remodeling (GO:0043044),1/42,0.09227181253348396,0.1411777835657239,0,0,10.792953929539296,25.71978809417909,ACTB
heterophilic cell-cell adhesion via plasma membrane cell adhesion molecules (GO:0007157),1/42,0.09227181253348396,0.1411777835657239,0,0,10.792953929539296,25.71978809417909,CEACAM8
negative regulation of protein catabolic process (GO:0042177),1/42,0.09227181253348396,0.1411777835657239,0,0,10.792953929539296,25.71978809417909,FLNA
monocyte chemotaxis (GO:0002548),1/42,0.09227181253348396,0.1411777835657239,0,0,10.792953929539296,25.71978809417909,S100A12
substantia nigra development (GO:0021762),1/43,0.09436397729271122,0.14408053557709422,0,0,10.535449735449735,24.869939188170132,ACTB
positive regulation of cell population proliferation (GO:0008284),3/474,0.09520038955095364,0.1450579131508345,0,0,2.8859428232854394,6.787077347300079,NAMPT;GAB2;LTF
positive regulation of biosynthetic process (GO:0009891),1/44,0.09645142457009452,0.14546449542306092,0,0,10.289922480620156,24.065203974439605,MMP8
positive regulation of osteoblast differentiation (GO:0045669),1/44,0.09645142457009452,0.14546449542306092,0,0,10.289922480620156,24.065203974439605,LTF
positive regulation of potassium ion transmembrane transport (GO:1901381),1/44,0.09645142457009452,0.14546449542306092,0,0,10.289922480620156,24.065203974439605,FLNA
positive regulation of receptor-mediated endocytosis (GO:0048260),1/44,0.09645142457009452,0.14546449542306092,0,0,10.289922480620156,24.065203974439605,B2M
mitotic spindle assembly (GO:0090307),1/44,0.09645142457009452,0.14546449542306092,0,0,10.289922480620156,24.065203974439605,FLNA
negative regulation of T cell activation (GO:0050868),1/45,0.09853416477511664,0.14761814296059614,0,0,10.055555555555555,23.30226117880883,RIPOR2
regulation of insulin receptor signaling pathway (GO:0046626),1/45,0.09853416477511664,0.14761814296059614,0,0,10.055555555555555,23.30226117880883,SORL1
protein deacetylation (GO:0006476),1/45,0.09853416477511664,0.14761814296059614,0,0,10.055555555555555,23.30226117880883,FLNA
regulation of autophagy (GO:0010506),2/231,0.09880796517574712,0.14761814296059614,0,0,3.9152441445017865,9.062134274468654,PSAP;MCL1
positive regulation of gene expression (GO:0010628),3/482,0.09887818777468889,0.14761814296059614,0,0,2.8365781424479293,6.563463458868195,MMP8;ETS1;ACTB
regulation of gene expression (GO:0010468),5/1079,0.10051752765948768,0.14811239429030207,0,0,2.143797974292592,4.925211121040805,AHNAK;NR3C1;MMP8;ETS1;LTF
regulation of cellular protein localization (GO:1903827),1/46,0.1006122083000428,0.14811239429030207,0,0,9.831604938271605,22.57810056486298,LCP1
positive regulation of nucleocytoplasmic transport (GO:0046824),1/46,0.1006122083000428,0.14811239429030207,0,0,9.831604938271605,22.57810056486298,FLNA
positive regulation of organelle assembly (GO:1902117),1/46,0.1006122083000428,0.14811239429030207,0,0,9.831604938271605,22.57810056486298,LCP1
negative regulation of tumor necrosis factor production (GO:0032720),1/46,0.1006122083000428,0.14811239429030207,0,0,9.831604938271605,22.57810056486298,BPI
positive regulation of response to stimulus (GO:0048584),1/46,0.1006122083000428,0.14811239429030207,0,0,9.831604938271605,22.57810056486298,B2M
vesicle organization (GO:0016050),1/46,0.1006122083000428,0.14811239429030207,0,0,9.831604938271605,22.57810056486298,SRGN
positive regulation of cell-cell adhesion (GO:0022409),1/47,0.10268556547660973,0.15026659977666254,0,0,9.617391304347827,21.889987798811458,JAK1
glycosphingolipid metabolic process (GO:0006687),1/47,0.10268556547660973,0.15026659977666254,0,0,9.617391304347827,21.889987798811458,PSAP
regulation of DNA binding (GO:0051101),1/47,0.10268556547660973,0.15026659977666254,0,0,9.617391304347827,21.889987798811458,MMP8
positive regulation of blood vessel endothelial cell migration (GO:0043536),1/48,0.10475424665272434,0.15179095740463389,0,0,9.412293144208038,21.235433925545344,ETS1
positive regulation of endocytosis (GO:0045807),1/48,0.10475424665272434,0.15179095740463389,0,0,9.412293144208038,21.235433925545344,B2M
negative regulation of MAP kinase activity (GO:0043407),1/48,0.10475424665272434,0.15179095740463389,0,0,9.412293144208038,21.235433925545344,SORL1
regulation of interleukin-10 production (GO:0032653),1/48,0.10475424665272434,0.15179095740463389,0,0,9.412293144208038,21.235433925545344,MMP8
nucleus organization (GO:0006997),1/48,0.10475424665272434,0.15179095740463389,0,0,9.412293144208038,21.235433925545344,SYNE1
negative regulation of catabolic process (GO:0009895),1/49,0.10681826213767642,0.15387659984355337,0,0,9.21574074074074,20.612168790008823,FLNA
adherens junction organization (GO:0034332),1/49,0.10681826213767642,0.15387659984355337,0,0,9.21574074074074,20.612168790008823,ACTB
receptor internalization (GO:0031623),1/49,0.10681826213767642,0.15387659984355337,0,0,9.21574074074074,20.612168790008823,ITGB2
actin polymerization or depolymerization (GO:0008154),1/50,0.10887762220856746,0.15532927183809142,0,0,9.02721088435374,20.018117808730278,CFL1
positive regulation of cell morphogenesis involved in differentiation (GO:0010770),1/50,0.10887762220856746,0.15532927183809142,0,0,9.02721088435374,20.018117808730278,FLNA
negative regulation of ERK1 and ERK2 cascade (GO:0070373),1/50,0.10887762220856746,0.15532927183809142,0,0,9.02721088435374,20.018117808730278,DUSP6
regulation of cellular component movement (GO:0051270),1/50,0.10887762220856746,0.15532927183809142,0,0,9.02721088435374,20.018117808730278,ETS1
iron ion transport (GO:0006826),1/50,0.10887762220856746,0.15532927183809142,0,0,9.02721088435374,20.018117808730278,LTF
