Term,Overlap,P.value,Adjusted.P.value,Old.P.value,Old.Adjusted.P.value,Odds.Ratio,Combined.Score,Genes
regulation of substrate adhesion-dependent cell spreading (GO:1900024),1/51,0.11093233713692385,0.15734932273356378,0,0,8.846222222222222,19.451381614691524,FLNA
inositol lipid-mediated signaling (GO:0048017),1/51,0.11093233713692385,0.15734932273356378,0,0,8.846222222222222,19.451381614691524,GAB2
intrinsic apoptotic signaling pathway in response to DNA damage (GO:0008630),1/51,0.11093233713692385,0.15734932273356378,0,0,8.846222222222222,19.451381614691524,MCL1
positive regulation of nucleic acid-templated transcription (GO:1903508),3/511,0.11268688073272012,0.1587338522746195,0,0,2.67066471342245,5.830441034144349,USP22;FOS;ETS1
negative regulation of BMP signaling pathway (GO:0030514),1/52,0.11298241718058168,0.1587338522746195,0,0,8.672331154684096,18.910218175570737,SORL1
glycolipid metabolic process (GO:0006664),1/52,0.11298241718058168,0.1587338522746195,0,0,8.672331154684096,18.910218175570737,PSAP
negative regulation of protein metabolic process (GO:0051248),1/52,0.11298241718058168,0.1587338522746195,0,0,8.672331154684096,18.910218175570737,FLNA
negative regulation of protein-containing complex assembly (GO:0031333),1/52,0.11298241718058168,0.1587338522746195,0,0,8.672331154684096,18.910218175570737,SORL1
positive regulation of signal transduction (GO:0009967),2/252,0.1141927466343748,0.1601298667225863,0,0,3.5825454545454547,7.773648943224575,FLNA;SORL1
negative regulation of cysteine-type endopeptidase activity (GO:2000117),1/53,0.11502787253673812,0.16038792038613106,0,0,8.505128205128205,18.393027043859387,LTF
IRE1-mediated unfolded protein response (GO:0036498),1/53,0.11502787253673812,0.16038792038613106,0,0,8.505128205128205,18.393027043859387,TLN1
positive regulation of NIK/NF-kappaB signaling (GO:1901224),1/53,0.11502787253673812,0.16038792038613106,0,0,8.505128205128205,18.393027043859387,MMP8
"regulation of alternative mRNA splicing, via spliceosome (GO:0000381)",1/54,0.11706871342498994,0.16201082251136248,0,0,8.344234800838574,17.89833543767599,WTAP
regulation of cyclin-dependent protein kinase activity (GO:1904029),1/54,0.11706871342498994,0.16201082251136248,0,0,8.344234800838574,17.89833543767599,ACTB
negative regulation of viral genome replication (GO:0045071),1/54,0.11706871342498994,0.16201082251136248,0,0,8.344234800838574,17.89833543767599,LTF
regulation of potassium ion transmembrane transport (GO:1901379),1/54,0.11706871342498994,0.16201082251136248,0,0,8.344234800838574,17.89833543767599,FLNA
positive regulation of cell differentiation (GO:0045597),2/258,0.11869800264545177,0.16390792935844256,0,0,3.4975142045454546,7.453807155802997,RIPOR2;LTF
negative regulation of cytokine-mediated signaling pathway (GO:0001960),1/55,0.11910495002095219,0.16390792935844256,0,0,8.189300411522634,17.42478592911776,SAMHD1
regulation of blood vessel endothelial cell migration (GO:0043535),1/55,0.11910495002095219,0.16390792935844256,0,0,8.189300411522634,17.42478592911776,ETS1
Rho protein signal transduction (GO:0007266),1/56,0.12113659247839492,0.16639394394337148,0,0,8.04,16.971125513183228,CFL1
regulation of bone mineralization (GO:0030500),1/57,0.12316365091495214,0.1682401811943616,0,0,7.896031746031746,16.536195888856938,SRGN
"positive regulation of gene expression, epigenetic (GO:0045815)",1/57,0.12316365091495214,0.1682401811943616,0,0,7.896031746031746,16.536195888856938,ACTB
carboxylic acid transport (GO:0046942),1/57,0.12316365091495214,0.1682401811943616,0,0,7.896031746031746,16.536195888856938,PSAP
receptor metabolic process (GO:0043112),1/58,0.12518613547672552,0.17005984212739,0,0,7.757115009746589,16.11892479212372,ITGB2
RNA modification (GO:0009451),1/58,0.12518613547672552,0.17005984212739,0,0,7.757115009746589,16.11892479212372,ADAR
positive regulation of protein binding (GO:0032092),1/58,0.12518613547672552,0.17005984212739,0,0,7.757115009746589,16.11892479212372,B2M
protein deubiquitination (GO:0016579),2/267,0.12553943098383155,0.17022686146247984,0,0,3.3771869639794168,7.008120149275217,USP22;ACTB
negative regulation of autophagy (GO:0010507),1/59,0.12720405622576708,0.1718533776066579,0,0,7.622988505747126,15.718318266429916,MCL1
response to reactive oxygen species (GO:0000302),1/59,0.12720405622576708,0.1718533776066579,0,0,7.622988505747126,15.718318266429916,FOS
homophilic cell adhesion via plasma membrane adhesion molecules (GO:0007156),1/60,0.1292174232451343,0.1736212286875532,0,0,7.493408662900189,15.333453732333883,EMB
RNA methylation (GO:0001510),1/60,0.1292174232451343,0.1736212286875532,0,0,7.493408662900189,15.333453732333883,WTAP
cellular response to chemokine (GO:1990869),1/60,0.1292174232451343,0.1736212286875532,0,0,7.493408662900189,15.333453732333883,RIPOR2
positive regulation of MAPK cascade (GO:0043410),2/274,0.1309260570795251,0.17559774261664074,0,0,3.2891042780748663,6.687152126120194,S100A12;MMP8
iron ion homeostasis (GO:0055072),1/61,0.13122624658182752,0.17568151489849737,0,0,7.368148148148149,14.96347378325842,B2M
protein modification by small protein removal (GO:0070646),2/276,0.1324751343157484,0.17703277442918275,0,0,3.2647644326476444,6.599265267556147,USP22;ACTB
"positive regulation of transcription, DNA-templated (GO:0045893)",5/1183,0.13400815476743907,0.17875817034862362,0,0,1.943765787403205,3.906686656581266,USP22;NAMPT;FOS;NR3C1;ETS1
actin cytoskeleton reorganization (GO:0031532),1/63,0.13523030227867788,0.17877494344175843,0,0,7.129749103942652,14.265030973088258,FLNA
negative regulation of peptidase activity (GO:0010466),1/63,0.13523030227867788,0.17877494344175843,0,0,7.129749103942652,14.265030973088258,SERPINB1
cellular response to reactive oxygen species (GO:0034614),1/63,0.13523030227867788,0.17877494344175843,0,0,7.129749103942652,14.265030973088258,FOS
neuropeptide signaling pathway (GO:0007218),1/63,0.13523030227867788,0.17877494344175843,0,0,7.129749103942652,14.265030973088258,SORL1
positive regulation of viral process (GO:0048524),1/63,0.13523030227867788,0.17877494344175843,0,0,7.129749103942652,14.265030973088258,ADAR
negative regulation of intrinsic apoptotic signaling pathway (GO:2001243),1/64,0.13722555462281913,0.18076592667783128,0,0,7.016225749559083,13.935131696937612,MCL1
regulation of innate immune response (GO:0045088),1/64,0.13722555462281913,0.18076592667783128,0,0,7.016225749559083,13.935131696937612,SAMHD1
regulation of RNA metabolic process (GO:0051252),1/65,0.13921630325203724,0.18241285124690695,0,0,6.90625,13.617235566553108,AHNAK
regulation of cellular catabolic process (GO:0031329),1/65,0.13921630325203724,0.18241285124690695,0,0,6.90625,13.617235566553108,PSAP
protein autoubiquitination (GO:0051865),1/65,0.13921630325203724,0.18241285124690695,0,0,6.90625,13.617235566553108,KLHL24
positive regulation of cell cycle (GO:0045787),1/66,0.1412025581168882,0.18468794769624847,0,0,6.79965811965812,13.31073764113508,USP22
positive regulation of catabolic process (GO:0009896),1/67,0.14318432912272544,0.18661943425342875,0,0,6.696296296296296,13.015071906709133,SORL1
vascular endothelial growth factor receptor signaling pathway (GO:0048010),1/67,0.14318432912272544,0.18661943425342875,0,0,6.696296296296296,13.015071906709133,CYBB
positive regulation of protein localization to nucleus (GO:1900182),1/68,0.14516162617874134,0.1888634537783272,0,0,6.596019900497512,12.729708236779256,FLNA
positive regulation of MAP kinase activity (GO:0043406),1/69,0.14713445914858997,0.19109378789245693,0,0,6.498692810457516,12.454149635186281,S100A12
positive regulation of cell-substrate adhesion (GO:0010811),1/70,0.14910283790143838,0.19297197409660766,0,0,6.404186795491143,12.187929722777866,FLNA
negative regulation of viral process (GO:0048525),1/70,0.14910283790143838,0.19297197409660766,0,0,6.404186795491143,12.187929722777866,LTF
Fc-gamma receptor signaling pathway involved in phagocytosis (GO:0038096),1/71,0.15106677225376997,0.19381657065197225,0,0,6.312380952380952,11.93061045195859,ACTB
regulation of endopeptidase activity (GO:0052548),1/71,0.15106677225376997,0.19381657065197225,0,0,6.312380952380952,11.93061045195859,SERPINB1
nucleic acid metabolic process (GO:0090304),1/71,0.15106677225376997,0.19381657065197225,0,0,6.312380952380952,11.93061045195859,WTAP
phosphatidylinositol-mediated signaling (GO:0048015),1/71,0.15106677225376997,0.19381657065197225,0,0,6.312380952380952,11.93061045195859,GAB2
myeloid leukocyte differentiation (GO:0002573),1/71,0.15106677225376997,0.19381657065197225,0,0,6.312380952380952,11.93061045195859,GAB2
extrinsic apoptotic signaling pathway (GO:0097191),1/72,0.15302627203462094,0.1953133247557597,0,0,6.223161189358373,11.68178001613074,MCL1
Fc-gamma receptor signaling pathway (GO:0038094),1/72,0.15302627203462094,0.1953133247557597,0,0,6.223161189358373,11.68178001613074,ACTB
negative regulation of epithelial cell proliferation (GO:0050680),1/72,0.15302627203462094,0.1953133247557597,0,0,6.223161189358373,11.68178001613074,B2M
MAPK cascade (GO:0000165),2/303,0.1537837626773474,0.19577985545434426,0,0,2.967834491090305,5.556402888532314,DUSP6;JAK1
positive regulation of transcription by RNA polymerase II (GO:0045944),4/908,0.15489526545039176,0.19577985545434426,0,0,2.006953223767383,3.7429799991760895,NAMPT;FOS;NR3C1;ETS1
regulation of Rho protein signal transduction (GO:0035023),1/73,0.15498134701054317,0.19577985545434426,0,0,6.13641975308642,11.44105094540804,RIPOR2
negative regulation of cell adhesion (GO:0007162),1/73,0.15498134701054317,0.19577985545434426,0,0,6.13641975308642,11.44105094540804,RIPOR2
positive regulation of JNK cascade (GO:0046330),1/73,0.15498134701054317,0.19577985545434426,0,0,6.13641975308642,11.44105094540804,MMP8
insulin receptor signaling pathway (GO:0008286),1/73,0.15498134701054317,0.19577985545434426,0,0,6.13641975308642,11.44105094540804,NAMPT
Fc receptor mediated stimulatory signaling pathway (GO:0002431),1/74,0.15693200698822565,0.19723257340867137,0,0,6.052054794520548,11.20805835747445,ACTB
regulation of cytokine-mediated signaling pathway (GO:0001959),1/74,0.15693200698822565,0.19723257340867137,0,0,6.052054794520548,11.20805835747445,JAK1
mitotic nuclear division (GO:0140014),1/74,0.15693200698822565,0.19723257340867137,0,0,6.052054794520548,11.20805835747445,FLNA
positive regulation of immune response (GO:0050778),1/75,0.15887826166448996,0.19933961862488636,0,0,5.96996996996997,10.982458365229922,ITGB2
regulation of RNA splicing (GO:0043484),1/76,0.16082012081952446,0.19974129291702283,0,0,5.890074074074074,10.763926603538268,AHNAK
regulation of BMP signaling pathway (GO:0030510),1/76,0.16082012081952446,0.19974129291702283,0,0,5.890074074074074,10.763926603538268,SORL1
positive regulation of interleukin-6 production (GO:0032755),1/76,0.16082012081952446,0.19974129291702283,0,0,5.890074074074074,10.763926603538268,MMP8
cell morphogenesis involved in neuron differentiation (GO:0048667),1/76,0.16082012081952446,0.19974129291702283,0,0,5.890074074074074,10.763926603538268,ACTB
cellular response to hormone stimulus (GO:0032870),1/76,0.16082012081952446,0.19974129291702283,0,0,5.890074074074074,10.763926603538268,NR3C1
water-soluble vitamin metabolic process (GO:0006767),1/76,0.16082012081952446,0.19974129291702283,0,0,5.890074074074074,10.763926603538268,SLC2A3
positive regulation of tumor necrosis factor production (GO:0032760),1/77,0.16275759412626153,0.20180849338809947,0,0,5.812280701754386,10.552156890784307,MMP8
negative regulation of apoptotic signaling pathway (GO:2001234),1/78,0.16469069128213965,0.20352244290552038,0,0,5.7365079365079366,10.346859986896192,MCL1
negative regulation of protein serine/threonine kinase activity (GO:0071901),1/78,0.16469069128213965,0.20352244290552038,0,0,5.7365079365079366,10.346859986896192,SORL1
recombinational repair (GO:0000725),1/79,0.16661942196018775,0.2048781245067866,0,0,5.662678062678062,10.147762456924237,SAMHD1
axon development (GO:0061564),1/79,0.16661942196018775,0.2048781245067866,0,0,5.662678062678062,10.147762456924237,ACTB
regulation of ion transport (GO:0043269),1/79,0.16661942196018775,0.2048781245067866,0,0,5.662678062678062,10.147762456924237,B2M
negative regulation of cellular component organization (GO:0051129),1/80,0.16854379579764434,0.20553443084894252,0,0,5.590717299578059,9.954605622805227,SORL1
negative regulation of cellular response to growth factor stimulus (GO:0090288),1/80,0.16854379579764434,0.20553443084894252,0,0,5.590717299578059,9.954605622805227,SORL1
negative regulation of extrinsic apoptotic signaling pathway (GO:2001237),1/80,0.16854379579764434,0.20553443084894252,0,0,5.590717299578059,9.954605622805227,MCL1
regulation of NIK/NF-kappaB signaling (GO:1901222),1/80,0.16854379579764434,0.20553443084894252,0,0,5.590717299578059,9.954605622805227,MMP8
regulation of protein localization to plasma membrane (GO:1903076),1/80,0.16854379579764434,0.20553443084894252,0,0,5.590717299578059,9.954605622805227,ACTB
negative regulation of gene expression (GO:0010629),2/322,0.16916332577758678,0.20595007866496975,0,0,2.7889204545454547,4.955606556639288,SRGN;MMP8
regulation of interleukin-8 production (GO:0032677),1/81,0.17046382240589766,0.20685183047283803,0,0,5.520555555555555,9.767144595990155,BPI
positive regulation of tumor necrosis factor superfamily cytokine production (GO:1903557),1/81,0.17046382240589766,0.20685183047283803,0,0,5.520555555555555,9.767144595990155,MMP8
regulation of cyclin-dependent protein serine/threonine kinase activity (GO:0000079),1/82,0.17237951139549326,0.2078115153691183,0,0,5.452126200274348,9.585147383985147,ACTB
cell-cell junction organization (GO:0045216),1/82,0.17237951139549326,0.2078115153691183,0,0,5.452126200274348,9.585147383985147,TLN1
"regulation of gene expression, epigenetic (GO:0040029)",1/82,0.17237951139549326,0.2078115153691183,0,0,5.452126200274348,9.585147383985147,ACTB
ephrin receptor signaling pathway (GO:0048013),1/82,0.17237951139549326,0.2078115153691183,0,0,5.452126200274348,9.585147383985147,ACTB
regulation of defense response (GO:0031347),1/83,0.1742908723742125,0.20875357323264676,0,0,5.385365853658537,9.408394065633235,SAMHD1
positive regulation of plasma membrane bounded cell projection assembly (GO:0120034),1/83,0.1742908723742125,0.20875357323264676,0,0,5.385365853658537,9.408394065633235,RIPOR2
regulation of interleukin-1 beta production (GO:0032651),1/83,0.1742908723742125,0.20875357323264676,0,0,5.385365853658537,9.408394065633235,SERPINB1
regulation of osteoblast differentiation (GO:0045667),1/83,0.1742908723742125,0.20875357323264676,0,0,5.385365853658537,9.408394065633235,LTF
spindle assembly (GO:0051225),1/84,0.17619791485755867,0.210355830500381,0,0,5.320214190093708,9.23667603092824,FLNA
vascular transport (GO:0010232),1/84,0.17619791485755867,0.210355830500381,0,0,5.320214190093708,9.23667603092824,SLC2A3
positive regulation of protein catabolic process (GO:0045732),1/85,0.1781006483840695,0.21228448250939896,0,0,5.256613756613756,9.069795270996941,SORL1
positive regulation of cytokine production (GO:0001819),2/335,0.1798375041753609,0.21317199036688356,0,0,2.6782691782691783,4.595110688679952,MMP8;SORL1
negative regulation of cellular amide metabolic process (GO:0034249),1/86,0.17999908252900587,0.21317199036688356,0,0,5.1945098039215685,8.907563723274029,SORL1
positive regulation of endothelial cell migration (GO:0010595),1/86,0.17999908252900587,0.21317199036688356,0,0,5.1945098039215685,8.907563723274029,ETS1
transport across blood-brain barrier (GO:0150104),1/86,0.17999908252900587,0.21317199036688356,0,0,5.1945098039215685,8.907563723274029,SLC2A3
sensory perception of mechanical stimulus (GO:0050954),1/88,0.1837830905392396,0.21695799346405445,0,0,5.074584929757344,8.596342164509942,RIPOR2
positive regulation of neuron projection development (GO:0010976),1/88,0.1837830905392396,0.21695799346405445,0,0,5.074584929757344,8.596342164509942,S100A9
regulation of cation channel activity (GO:2001257),1/89,0.1856686833588573,0.2177923127018977,0,0,5.016666666666667,8.44702052052336,AHNAK
regulation of endothelial cell migration (GO:0010594),1/89,0.1856686833588573,0.2177923127018977,0,0,5.016666666666667,8.44702052052336,ETS1
transforming growth factor beta receptor signaling pathway (GO:0007179),1/89,0.1856686833588573,0.2177923127018977,0,0,5.016666666666667,8.44702052052336,FOS
post-Golgi vesicle-mediated transport (GO:0006892),1/89,0.1856686833588573,0.2177923127018977,0,0,5.016666666666667,8.44702052052336,SORL1
"regulation of mRNA splicing, via spliceosome (GO:0048024)",1/90,0.18755001462176596,0.21965049256019817,0,0,4.960049937578027,8.30168381449168,WTAP
positive regulation of multicellular organismal process (GO:0051240),2/345,0.18812039409988746,0.21996989120224184,0,0,2.5988603233501193,4.341846102966184,CFL1;SORL1
sensory perception of sound (GO:0007605),1/91,0.18942709377430825,0.22079908880002178,0,0,4.904691358024691,8.160185435636516,RIPOR2
positive regulation of transport (GO:0051050),1/91,0.18942709377430825,0.22079908880002178,0,0,4.904691358024691,8.160185435636516,ACTB
T cell activation (GO:0042110),1/92,0.1912999301686515,0.2219319441046051,0,0,4.85054945054945,8.022385666002098,LCP1
regulation of lipid metabolic process (GO:0019216),1/92,0.1912999301686515,0.2219319441046051,0,0,4.85054945054945,8.022385666002098,PSAP
regulation of peptidyl-tyrosine phosphorylation (GO:0050730),1/92,0.1912999301686515,0.2219319441046051,0,0,4.85054945054945,8.022385666002098,ITGB2
cellular response to DNA damage stimulus (GO:0006974),2/350,0.19228288819832048,0.22272265576576622,0,0,2.5608672936259143,4.222326278093028,SAMHD1;MCL1
regulation of epithelial cell proliferation (GO:0050678),1/93,0.1931685332408311,0.22339835064941188,0,0,4.797584541062802,7.888151282241151,B2M
negative regulation of cell death (GO:0060548),1/94,0.19503291231959316,0.2248507366679865,0,0,4.745758661887694,7.757355193343563,SORL1
positive regulation of epithelial cell migration (GO:0010634),1/94,0.19503291231959316,0.2248507366679865,0,0,4.745758661887694,7.757355193343563,ETS1
gene expression (GO:0010467),2/356,0.19729485787294734,0.22710420555780075,0,0,2.516692347200822,4.084732435019228,ADAR;SORL1
double-strand break repair via homologous recombination (GO:0000724),1/97,0.20060079887425283,0.2305505293438147,0,0,4.596759259259259,7.384410686337352,SAMHD1
negative regulation of neuron death (GO:1901215),1/98,0.2024483751456497,0.23231265408794277,0,0,4.54914089347079,7.266207923932136,SORL1
positive regulation of stress-activated MAPK cascade (GO:0032874),1/99,0.2042917739097955,0.23406452855711454,0,0,4.502494331065759,7.150888703946834,MMP8
cell-matrix adhesion (GO:0007160),1/100,0.20613100438312365,0.23580621089648357,0,0,4.45679012345679,7.038356248208516,ITGB2
cellular response to chemical stress (GO:0062197),1/101,0.20796607582317628,0.23717118832303594,0,0,4.412,6.928517925895823,CYBB
positive regulation of protein localization to membrane (GO:1905477),1/101,0.20796607582317628,0.23717118832303594,0,0,4.412,6.928517925895823,ITGB2
intrinsic apoptotic signaling pathway (GO:0097193),1/102,0.20979699739375907,0.2385230478061353,0,0,4.368096809680968,6.821285040264925,MCL1
positive regulation of vasculature development (GO:1904018),1/102,0.20979699739375907,0.2385230478061353,0,0,4.368096809680968,6.821285040264925,ETS1
cellular response to organonitrogen compound (GO:0071417),1/103,0.2116237782804449,0.23986192047430796,0,0,4.325054466230937,6.7165726231791085,ACTB
chromatin remodeling (GO:0006338),1/103,0.2116237782804449,0.23986192047430796,0,0,4.325054466230937,6.7165726231791085,ACTB
regulation of JNK cascade (GO:0046328),1/105,0.21526495458182926,0.24361531613471948,0,0,4.2414529914529915,6.514386838497086,MMP8
negative regulation of cell population proliferation (GO:0008285),2/379,0.21665475972488732,0.24481325296130235,0,0,2.3603809983120327,3.6100850988020996,ETS1;B2M
protein processing (GO:0016485),1/106,0.21707936826802343,0.24491855442758675,0,0,4.200846560846561,6.416760522811149,SRGN
negative regulation of transmembrane receptor protein serine/threonine kinase signaling pathway (GO:0090101),1/108,0.22069589219613858,0.2484586338562505,0,0,4.121910695742471,6.2280816665872045,SORL1
positive regulation of macromolecule metabolic process (GO:0010604),2/384,0.22088947556638236,0.2484586338562505,0,0,2.3288910042836743,3.5168415681103093,MMP8;ETS1
histone modification (GO:0016570),1/114,0.23144768738022192,0.25993896804556843,0,0,3.9018682399213374,5.709999458304172,USP22
positive regulation of protein metabolic process (GO:0051247),1/115,0.23322548859490452,0.26153814274906595,0,0,3.867446393762183,5.6300332746081745,SORL1
phosphorylation (GO:0016310),2/400,0.23448864269537908,0.2623330182144342,0,0,2.2334399269072636,3.2392654086626194,CTSG;JAK1
regulation of protein-containing complex assembly (GO:0043254),1/116,0.23499926665487883,0.2623330182144342,0,0,3.833623188405797,5.551749154521461,SORL1
sphingolipid metabolic process (GO:0006665),1/116,0.23499926665487883,0.2623330182144342,0,0,3.833623188405797,5.551749154521461,PSAP
positive regulation of cell projection organization (GO:0031346),1/117,0.23676903040121397,0.26390997506258995,0,0,3.800383141762452,5.47509862046217,S100A9
regulation of cellular response to stress (GO:0080135),1/118,0.23853478876934758,0.26468049384466646,0,0,3.7677113010446344,5.400034976248376,MCL1
negative regulation of response to external stimulus (GO:0032102),1/118,0.23853478876934758,0.26468049384466646,0,0,3.7677113010446344,5.400034976248376,LTF
positive regulation of protein-containing complex assembly (GO:0031334),1/118,0.23853478876934758,0.26468049384466646,0,0,3.7677113010446344,5.400034976248376,LCP1
regulation of cell migration (GO:0030334),2/408,0.24131055149755654,0.26735906680164057,0,0,2.188535602328706,3.111376678221433,FLNA;SORL1
cytoskeleton organization (GO:0007010),1/120,0.24205432476369537,0.26778165568917794,0,0,3.704014939309057,5.254490018618861,CFL1
protein targeting (GO:0006605),1/125,0.250783688414426,0.2770241341379085,0,0,3.553763440860215,4.915439470317898,SORL1
organelle organization (GO:0006996),2/420,0.2515636693396783,0.27747097260003323,0,0,2.124401913875598,2.931800327294394,CFL1;SYNE1
regulation of cell population proliferation (GO:0042127),3/764,0.2565482735698598,0.2825472044234373,0,0,1.759588057329707,2.3938112159671636,NAMPT;GAB2;ETS1
positive regulation of macromolecule biosynthetic process (GO:0010557),1/129,0.25769629607017885,0.2825483127535047,0,0,3.442013888888889,4.667279738567,NAMPT
cellular response to insulin stimulus (GO:0032869),1/129,0.25769629607017885,0.2825483127535047,0,0,3.442013888888889,4.667279738567,NAMPT
muscle contraction (GO:0006936),1/129,0.25769629607017885,0.2825483127535047,0,0,3.442013888888889,4.667279738567,TLN1
regulation of response to external stimulus (GO:0032101),1/130,0.2594146756143242,0.28317200188919583,0,0,3.4151593453919036,4.608168194413571,SAMHD1
Golgi organization (GO:0007030),1/130,0.2594146756143242,0.28317200188919583,0,0,3.4151593453919036,4.608168194413571,SYNE1
regulation of primary metabolic process (GO:0080090),1/130,0.2594146756143242,0.28317200188919583,0,0,3.4151593453919036,4.608168194413571,PSAP
regulation of cell adhesion (GO:0030155),1/133,0.26454649880748893,0.28749979796872693,0,0,3.337037037037037,4.437385770595149,RIPOR2
regulation of cell motility (GO:2000145),1/133,0.26454649880748893,0.28749979796872693,0,0,3.337037037037037,4.437385770595149,FLNA
transmembrane receptor protein serine/threonine kinase signaling pathway (GO:0007178),1/133,0.26454649880748893,0.28749979796872693,0,0,3.337037037037037,4.437385770595149,FOS
protein dephosphorylation (GO:0006470),1/139,0.2747059975928274,0.2981023968004397,0,0,3.1909822866344606,4.1229209578945945,DUSP6
neuron projection morphogenesis (GO:0048812),1/140,0.2763858462398367,0.29904705764456707,0,0,3.1678657074340526,4.0737403357741835,ACTB
transcription initiation from RNA polymerase II promoter (GO:0006367),1/140,0.2763858462398367,0.29904705764456707,0,0,3.1678657074340526,4.0737403357741835,NR3C1
Ras protein signal transduction (GO:0007265),1/142,0.27973413304863926,0.30178616689480936,0,0,3.122616233254531,3.977949693868639,CFL1
protein localization to organelle (GO:0033365),1/142,0.27973413304863926,0.30178616689480936,0,0,3.122616233254531,3.977949693868639,SORL1
negative regulation of DNA-binding transcription factor activity (GO:0043433),1/143,0.2814025880638636,0.3031436043428501,0,0,3.1004694835680753,3.9312989960385463,FLNA
positive regulation of transferase activity (GO:0051347),1/148,0.2896883145842489,0.31161523213647735,0,0,2.9942554799697656,3.709731962420885,SORL1
positive regulation of hydrolase activity (GO:0051345),1/149,0.2913342085625659,0.3129302036740352,0,0,2.973873873873874,3.667631625100376,PSAP
dephosphorylation (GO:0016311),1/153,0.2978805565797009,0.3194974329642946,0,0,2.8950292397660817,3.5060618977899556,DUSP6
positive regulation of protein kinase activity (GO:0045860),1/154,0.2995078778024667,0.320777277820323,0,0,2.8759622367465503,3.4673019425835068,LTF
mitotic spindle organization (GO:0007052),1/157,0.3043677348593961,0.32551050081200245,0,0,2.82022792022792,3.3547137209830717,FLNA
cellular response to growth factor stimulus (GO:0071363),1/158,0.3059803455767096,0.3258205697135279,0,0,2.802123142250531,3.3183706439641787,NR3C1
skeletal system development (GO:0001501),1/158,0.3059803455767096,0.3258205697135279,0,0,2.802123142250531,3.3183706439641787,RFLNB
T cell receptor signaling pathway (GO:0050852),1/158,0.3059803455767096,0.3258205697135279,0,0,2.802123142250531,3.3183706439641787,FYB1
positive regulation of protein kinase B signaling (GO:0051897),1/161,0.31079626654489523,0.3304725769448598,0,0,2.7491666666666665,3.212724752591863,GAB2
